id,title,timestamp,topics,result
138172,Continuous crackdown on civil society and human rights defenders in Russia: the case of human rights organisation Memorial,2021-12-16T15:32:12,,
138173,"The situation in Cuba, namely the cases of José Daniel Ferrer, Lady in White Aymara Nieto, Maykel Castillo, Luis Robles, Félix Navarro, Luis Manuel Otero, Reverend Lorenzo Rosales Fajardo, Andy Dunier García and Yunior García Aguilera",2021-12-16T15:32:12,,
138174,Forced labour in the Linglong factory and environmental protests in Serbia,2021-12-16T15:32:12,,
138175,"Fundamental rights and Rule of Law in Slovenia, in particular the delayed nomination of EPPO prosecutors",2021-12-16T15:32:12,,
138177,MeToo and harassment – the consequences for the EU institutions,2021-12-16T15:32:12,"Gender equality, Worker’s rights",
138178,Situation at the Ukrainian border and in Russian-occupied territories of Ukraine,2021-12-16T15:32:12,,
138179,Implementation of the Kimberley Process Certification scheme,2021-12-16T15:32:12,"International trade, Foreign affairs",
138182,The situation in Nicaragua,2021-12-16T15:32:12,,
137983,Digital Markets Act,2021-12-15T15:04:15,"Digital, Consumer protection",
137986,The impact of organised crime on own resources of the EU and on the misuse of EU funds,2021-12-15T15:04:15,Economy and budget,
137987,"Avoiding corruption, irregular spending and misuse of EU and national funds in case of emergency funds and crisis related spending areas",2021-12-15T15:04:15,Economy and budget,
137988,Implementation of the Energy Performance of Buildings Directive,2021-12-15T15:04:15,"Energy, Economy and budget",
137989,Challenges and prospects for multilateral weapons of mass destruction arms control and disarmament regimes,2021-12-15T15:04:15,,
137994,Transitional provisions for certain in vitro diagnostic medical devices and deferred application of requirements for in-house devices,2021-12-15T15:04:15,,
138003,New orientations for the EU’s humanitarian action,2021-12-15T15:04:15,Foreign affairs,
138004,Cooperation on the fight against organised crime in the Western Balkans,2021-12-15T15:04:15,Foreign affairs,
137643,EU-US air transport agreement,2021-12-14T14:49:19,,
137644,EC/Gabon Fisheries Partnership Agreement: Implementing Protocol,2021-12-14T14:49:19,Food and agriculture,
137646,Joint investigation teams: alignment with Union rules on the protection of personal data,2021-12-14T14:49:19,,
137662,International public procurement instrument,2021-12-14T14:49:19,"International trade, Economy and budget, Foreign affairs",
137684,European Year of Youth 2022,2021-12-14T14:49:19,"Education, youth and culture, Worker’s rights",
137764,Mobilisation of the European Globalisation Adjustment Fund: application EGF/2021/003 IT/Porto Canale - Italy,2021-12-14T14:49:19,"Worker’s rights, Economy and budget",
137765,Mobilisation of the European Globalisation Adjustment Fund: application EGF/2021/002 IT/Air Italy - Italy,2021-12-14T14:49:19,"Worker’s rights, Economy and budget",
137766,Mobilisation of the European Globalisation Adjustment Fund: application EGF/2021/004 ES/Aragón automotive - Spain,2021-12-14T14:49:19,"Worker’s rights, Economy and budget",
137767,Mobilisation of the European Union Solidarity Fund to provide assistance to Croatia,2021-12-14T14:49:19,"Climate and environment, Economy and budget",
137768,"Predictability for Member States and procedures for dispute resolution when making available the traditional, VAT and GNI based own resources",2021-12-14T14:49:19,Economy and budget,
137952,Combating gender-based violence: cyberviolence,2021-12-14T14:49:19,Gender equality,
137937,Union tariff rate quota for high quality beef from Paraguay,2021-12-13T20:53:37,International trade,
137528,Situation in Somalia,2021-11-25T15:36:34,,
137555,"Human rights violations by private military and security companies, particularly the Wagner Group",2021-11-25T15:36:34,,
137566,The human rights situation in Cameroon,2021-11-25T15:36:34,,
137603,The safety of truck parking lots in the EU,2021-11-25T11:39:37,,
137605,Mobilisation of the European Globalisation Adjustment Fund: redundancies in metal products manufacturing in Spain,2021-11-25T11:39:37,"Worker’s rights, Economy and budget",
137606,Legal migration policy and law,2021-11-25T11:39:37,Migration,
137607,Introduction of a European Social Security pass for improving the digital enforcement of social security rights and fair mobility,2021-11-25T11:39:37,Worker’s rights,
137608,"Multilateral negotiations in view of the 12th WTO Ministerial Conference in Geneva, 30 November to 3 December 2021",2021-11-25T11:39:37,International trade,
137460,A European strategy for critical raw materials,2021-11-24T14:50:29,,
137462,A Pharmaceutical Strategy for Europe,2021-11-24T14:50:29,Health,
137235,Common agricultural policy (CAP) 2021–2027,2021-11-23T14:20:39,Food and agriculture,
137260,Support for strategic plans to be drawn up by Member States under the common agricultural policy (CAP strategic plans) and financed by the European Agricultural Guarantee Fund (EAGF) and by the European Agricultural Fund for Rural Development (EAFRD) 2021–2027,2021-11-23T14:20:39,Food and agriculture,
137271,"Common agricultural policy: financing, management and monitoring",2021-11-23T14:20:39,Food and agriculture,
137366,Insolvency proceedings: replacing Annexes A and B to Regulation,2021-11-23T14:20:39,,
137367,Integrated farm statistics: Union contribution under the MFF for the years 2021 to 2027,2021-11-23T14:20:39,Food and agriculture,
137368,Packaged retail and insurance-based investment products (PRIIPs): key information documents. Extension of the transitional arrangement,2021-11-23T14:20:39,Consumer protection,
137369,Undertakings for collective investment in transferable securities (UCITS): the use of key information documents,2021-11-23T14:20:39,,
137370,EU sports policy: assessment and possible ways forward,2021-11-23T14:20:39,,
137371,"Digitalisation of the European reporting, monitoring and audit",2021-11-23T14:20:39,,
136941,European Partnership on Metrology,2021-11-11T11:06:29,Economy and budget,
136944,European Union Agency for Asylum,2021-11-11T11:10:22,Migration,
136957,"Strengthening democracy, media freedom and pluralism in the EU",2021-11-11T11:26:59,,
136958,An intellectual property action plan to support the EU’s recovery and resilience,2021-11-11T11:27:49,,
136959,The European Education Area: a shared holistic approach,2021-11-11T11:27:27,"Education, youth and culture",
136968,European political parties – report 2021,2021-11-11T11:31:19,,
136970,Serious cross-border threats to health,2021-11-11T11:11:25,Health,
136974,EU/Australia Agreement: modification of concessions on all the tariff-rate quotas included in the EU Schedule CLXXV,2021-11-11T11:13:18,"International trade, Foreign affairs",
136175,Insurance of motor vehicles,2021-10-21T11:52:25,Consumer protection,
136221,2019 Discharge: European Border and Coast Guard Agency,2021-10-21T11:52:25,Economy and budget,
136238,2019 Discharge: European Border and Coast Guard Agency,2021-10-21T15:49:08,Economy and budget,
136783,"Pandora Papers: implications on the efforts to combat money laundering, tax evasion and avoidance",2021-10-21T15:49:08,,
136804,"Climate, Energy and Environmental State aid guidelines (“CEEAG”)",2021-10-21T15:49:08,Economy and budget,
136887,Situation in Tunisia,2021-10-21T15:49:08,,
136902,The Rule of law crisis in Poland and the primacy of EU law,2021-10-21T15:49:08,,
136904,Joint Undertakings under Horizon Europe,2021-10-21T11:52:25,,
136905,"EU transparency in the development, purchase and distribution of COVID-19 vaccines",2021-10-21T11:52:25,Health,
136906,An EU strategy to reduce methane emissions,2021-10-21T11:52:25,Climate and environment,
136907,"UN Climate Change Conference in Glasgow, the UK (COP26)",2021-10-21T11:52:25,"Climate change, Climate and environment",
136738,EU-Taiwan political relations and cooperation,2021-10-20T22:27:37,Foreign affairs,
136179,"Draft amending budget 4/2021: Update of revenue, revised forecast of own resources and other revenue",2021-10-19T15:28:18,Economy and budget,
136183,Credit servicers and credit purchasers,2021-10-19T15:28:18,,
136185,2019 Discharge: EU general budget - Council and European Council,2021-10-19T15:28:18,Economy and budget,
136187,2019 Discharge: EU general budget - Council and European Council,2021-10-19T15:28:18,Economy and budget,
136566,Farm to Fork Strategy,2021-10-19T22:20:56,"Climate and environment, Food and agriculture, Consumer protection, Biodiversity, Health",
136568,Protecting workers from asbestos,2021-10-19T22:20:56,Worker’s rights,
136570,The effectiveness of Member States' use of EU Solidarity Fund money in cases of natural disasters,2021-10-19T22:20:56,Climate and environment,
136124,Banking Union - annual report 2020,2021-10-07T11:47:58,,
136125,Reforming the EU policy on harmful tax practices (including the reform of the Code of Conduct Group),2021-10-07T11:47:58,Taxation,
136127,"Human rights situation in Myanmar, including the situation of religious and ethnic groups",2021-10-07T15:52:04,,
136128,The case of Paul Rusesabagina in Rwanda,2021-10-07T15:52:04,,
136129,"The state law relating to abortion in Texas, USA",2021-10-07T15:52:04,Gender equality,
136130,The situation in Belarus after one year of protests and their violent repression,2021-10-07T15:52:04,,
136131,Humanitarian situation in Tigray,2021-10-07T15:52:04,Foreign affairs,
136000,The future of EU-US relations,2021-10-06T15:51:28,"Foreign affairs, International trade",
136002,Implementation report on the EU Trust Funds and the Facility for Refugees in Turkey,2021-10-06T22:49:29,"Migration, Foreign affairs",
136003,State of EU cyber defence capabilities,2021-10-06T22:49:29,,
136004,"The Arctic: opportunities, concerns and security challenges",2021-10-06T22:49:29,Foreign affairs,
136005,The protection of persons with disabilities through petitions: lessons learnt,2021-10-06T22:49:29,,
135785,Environment: The Aarhus Regulation,2021-10-05T14:31:05,Climate and environment,
135948,"The role of development policy in the response to biodiversity loss in developing countries, in the context of the achievement of the 2030 Agenda",2021-10-05T22:35:50,"Climate and environment, Biodiversity, Foreign affairs",
135949,Artificial intelligence in criminal law and its use by the police and judicial authorities in criminal matters,2021-10-05T22:35:50,Economy and budget,
135950,The impact of intimate partner violence and custody rights on women and children,2021-10-05T22:35:50,Gender equality,
135951,"EU Road Safety Policy Framework 2021-2030 - Recommendations on next steps towards ""Vision Zero""",2021-10-05T22:35:50,,
135952,Rebuilding fish stocks in the Mediterranean,2021-10-05T22:35:50,Food and agriculture,
135953,"Objection pursuant to Rule 112(2) and (3): Active substances, including chlorotoluron and difenoconazole",2021-10-05T22:35:50,Food and agriculture,
135954,Technical screening criteria for determining the conditions under which an economic activity qualifies as contributing substantially to climate change mitigation or climate change adaptation and for determining whether that economic activity causes no significant harm to any of the other environmental objectives,2021-10-05T22:35:50,Climate and environment,
135955,Technical screening criteria for determining the conditions under which an economic activity qualifies as contributing substantially to climate change mitigation or climate change adaptation and for determining whether that economic activity causes no significant harm to any of the other environmental objectives,2021-10-05T22:35:50,Climate and environment,
135959,"Proposal on the setting-up of a delegation to the EU-UK Parliamentary Assembly, and defining its numerical strength",2021-10-05T14:31:05,,
135961,Sustainable Fisheries Partnership Agreement EU/Greenland and Denmark (resolution),2021-10-05T14:31:05,Food and agriculture,
135745,Identifying gender-based violence as a new area of crime listed in Article 83(1) TFEU,2021-09-16T12:01:44,Gender equality,
135747,Government crackdown on protests and citizens in Cuba,2021-09-16T15:48:43,,
135748,The case of human rights defender Ahmed Mansoor in UAE,2021-09-16T15:48:43,,
135749,The situation in Kakuma refugee camp in Kenya,2021-09-16T15:48:43,,
135750,Implementation of EU requirements for exchange of tax information,2021-09-16T15:48:43,Taxation,
135752,Situation in Lebanon,2021-09-16T15:48:43,,
135753,Media freedom and further deterioration of the Rule of law in Poland,2021-09-16T15:48:43,,
135754,Strengthening transparency and integrity in the EU institutions by setting up an independent EU ethics body,2021-09-16T15:48:43,,
135150,Brexit Adjustment Reserve,2021-09-15T15:22:30,Economy and budget,
135154,EU Blue Card Directive,2021-09-15T15:22:30,"Migration, Worker’s rights",
135497,Official controls on animals and products of animal origin in order to ensure compliance with the prohibition of certain uses of antimicrobials,2021-09-15T15:22:30,"Food and agriculture, Consumer protection",
135498,Extension of validity of safety certificates and licences of railway undertakings operating in the Channel tunnel,2021-09-15T15:22:30,,
135560,Criteria for the designation of antimicrobials to be reserved for the treatment of certain infections in humans,2021-09-15T22:38:59,"Food and agriculture, Consumer protection, Health",
135561,A new EU-China strategy,2021-09-15T22:38:59,"Foreign affairs, International trade",
135564,Guidelines for the employment policies of the Member States,2021-09-15T22:38:59,Worker’s rights,
135565,"Fair working conditions, rights and social protection for platform workers - New forms of employment linked to digital development",2021-09-15T22:38:59,Worker’s rights,
135573,European Centre for Disease Prevention and Control,2021-09-15T15:22:30,Health,
135575,Serious cross-border threats to health,2021-09-15T15:22:30,Health,
135148,Community plant variety rights: extension of the term for certain varieties,2021-09-13T21:08:45,Food and agriculture,
135091,Decision on the numerical strength of the special committees and the committee of inquiry,2021-07-08T15:53:14.480000,,
135092,The case of Ahmadreza Djalali in Iran,2021-07-08T15:53:14.480000,,
135093,"Hong Kong, notably the case of Apple Daily",2021-07-08T15:53:14.480000,,
135094,"The death penalty in Saudi Arabia, notably the cases of Mustafa Hashem al-Darwish and Abdullah al-Howaiti",2021-07-08T15:53:14.480000,,
135096,The situation in Nicaragua,2021-07-08T15:53:14.480000,,
135097,"The repression of the opposition in Turkey, specifically the Peoples’ Democratic Party (HDP)",2021-07-08T15:53:14.480000,,
135098,The establishment of Antarctic Marine Protected Areas (MPAs) and the conservation of Southern Ocean biodiversity,2021-07-08T15:53:14.480000,"Biodiversity, Climate and environment",
135099,Breaches of EU law and of the rights of LGBTIQ citizens in Hungary as a result of the legal changes adopted by the Hungarian Parliament,2021-07-08T15:53:14.480000,,
135103,A new ERA for Research and Innovation,2021-07-08T12:06:26.161000,,
135104,European Medicines Agency,2021-07-08T12:06:26.161000,Health,
135106,Union environment action programme (2021-2030),2021-07-08T12:06:26.161000,Climate and environment,
134945,Citizens’ dialogues and Citizens’ participation in the EU decision-making,2021-07-07T15:27:27,,
134946,EU-NATO cooperation in the context of transatlantic relations,2021-07-07T15:27:27,Foreign affairs,
134947,Old continent growing older - possibilities and challenges related to ageing policy post 2020,2021-07-07T15:27:27,"Worker’s rights, Social protection",
134949,The creation of guidelines for the application of the general regime of conditionality for the protection of the Union budget,2021-07-07T21:51:18,Economy and budget,
134950,EU global human rights sanctions regime (EU Magnitsky Act),2021-07-07T21:51:18,,
134951,Annual Report on the functioning of the Schengen area,2021-07-07T21:51:18,Migration,
134869,Common system of value added tax: conferral of implementing powers to the Commission to determine the meaning of the terms used in certain provisions,2021-07-06T22:11:22,Taxation,
134870,Amendments to Parliament's Rules of Procedure,2021-07-06T22:11:22,,
134871,Financial Activities of the European Investment Bank - annual report 2020,2021-07-06T22:11:22,,
134872,Control of the financial activities of the European Investment Bank - annual report 2019,2021-07-06T22:11:22,,
134873,Objection pursuant to Rule 112(2) and (3): Genetically modified soybean DAS-81419-2,2021-07-06T22:11:22,Food and agriculture,
134874,Objection pursuant to Rule 112(2) and (3): Genetically modified soybean DAS-81419-2 × DAS-44406–6,2021-07-06T22:11:22,Food and agriculture,
134875,"Objection pursuant to Rule 112(2) and (3): Genetically modified maize 1507 × MIR162 × MON810 × NK603 and genetically modified maize combining two or three of the single events 1507, MIR162, MON810 and NK603",2021-07-06T22:11:22,Food and agriculture,
134877,Protection of the EU’s financial interests - combatting fraud - annual report 2019,2021-07-06T22:11:22,Economy and budget,
134878,The impact on the fishing sector of offshore windfarms and other renewable energy systems,2021-07-06T22:11:22,"Food and agriculture, Energy",
134905,Objection pursuant to Rule 112(2) and (3): Genetically modified maize Bt 11 (SYN-BTØ11-1),2021-07-06T22:11:22,Food and agriculture,
134346,Official controls on animals and products of animal origin in order to ensure compliance with the prohibition of certain uses of antimicrobials,2021-06-24T16:51:12,"Food and agriculture, Consumer protection",
134347,Commission’s 2020 Rule of law report,2021-06-24T16:51:12,,
134348,"Sexual and reproductive health and rights in the EU, in the frame of women’s health",2021-06-24T16:51:12,"Gender equality, Health",
134349,25th anniversary of the International Conference on Population and Development (ICPD25) (Nairobi Summit),2021-06-24T16:51:12,,
134350,"Regulatory fitness, subsidiarity and proportionality - report on Better Law Making 2017, 2018 and 2019",2021-06-24T16:51:12,,
134351,2019-2020 Reports on Bosnia and Herzegovina,2021-06-24T16:51:12,Enlargement,
134041,Regulations and general conditions governing the performance of the Ombudsman’s duties,2021-06-23T19:50:12,,
134333,The role of the EU's development cooperation and humanitarian assistance in addressing the consequences of the COVID-19 pandemic,2021-06-23T19:50:12,"Foreign affairs, Health",
133930,Breach of the UN Convention of the Rights of the Child and the use of minors by the Moroccan authorities in the migratory crisis in Ceuta,2021-06-10T15:55:25,,
133931,"The situation in Sri Lanka, in particular the arrests under the Prevention of Terrorism Act",2021-06-10T15:55:25,,
133932,The listing of German NGOs as 'undesirable organisations' by Russia and the detention of Andrei Pivovarov,2021-06-10T15:55:25,,
133933,Human rights and political situation in Cuba,2021-06-10T15:55:25,,
133934,Systematic repression in Belarus and its consequences for European security following abductions from an EU civilian plane intercepted by Belarusian authorities,2021-06-10T15:55:25,,
133935,The situation in Afghanistan,2021-06-10T15:55:25,,
133936,"European Citizens' Initiative ""End the cage age""",2021-06-10T15:55:25,Food and agriculture,
133937,"Promoting gender equality in science, technology, engineering and mathematics (STEM) education and careers",2021-06-10T15:55:25,"Education, youth and culture, Gender equality",
133938,Future EU financing of the Euranet Plus radio network,2021-06-10T15:55:25,,
133940,The EU's Cybersecurity Strategy for the Digital Decade,2021-06-10T11:51:10,Digital,
133941,Rule of Law situation in the European Union and the application of the conditionality regulation 2020/2092,2021-06-10T11:51:10,Economy and budget,
133942,The views of Parliament on the ongoing assessment by the Commission and the Council of the national recovery and resilience plans,2021-06-10T11:51:10,,
133726,"Transitional provisions of certain machinery fitted with engines in the power range between 56kW and 130kW, and above 300kW in order to address the impact of COVID-19 crisis",2021-06-09T22:22:22,,
133727,The conflict of interest of the Prime Minister of the Czech Republic,2021-06-09T22:22:22,Economy and budget,
133728,"Meeting the Global Covid-19 challenge: effects of waiver of the WTO TRIPS agreement on Covid-19 vaccines, treatment, equipment and increasing production and manufacturing capacity in developing countries",2021-06-09T22:22:22,"International trade, Health, Foreign affairs",
133729,Objection pursuant to Rule 112(2) and (3): Maximum residue limit for imidacloprid,2021-06-09T22:22:22,"Food and agriculture, Consumer protection",
133730,"Commission Implementing Regulation (EU) 2021/745 of 6 May 2021 amending Implementing Regulation (EU) No 540/2011 as regards the extension of the approval periods of the active substances aluminium ammonium sulphate, aluminium silicate, beflubutamid, benthiavalicarb, bifenazate, boscalid, calcium carbonate, captan, carbon dioxide, cymoxanil, dimethomorph, ethephon, extract from tea tree, famoxadone, fat distillation residues, fatty acids C7 to C20, flumioxazine, fluoxastrobin, flurochloridone, folpet, formetanate, gibberellic acid, gibberellins, heptamaloxyloglucan, hydrolysed proteins, iron sulphate, metazachlor, metribuzin, milbemectin, Paecilomyces lilacinus strain 251, phenmedipham, phosmet, pirimiphos-methyl, plant oils/rape seed oil, potassium hydrogen carbonate, propamocarb, prothioconazole, quartz sand, fish oil, repellents by smell of animal or plant origin/sheep fat, S-metolachlor, Straight Chain Lepidopteran Pheromones, tebuconazole and urea",2021-06-09T22:22:22,Food and agriculture,
132415,ETIAS consequential amendments: ECRIS-TCN,2021-06-08T15:24:57,Migration,
132417,Competition policy - annual report 2020,2021-06-08T22:21:23,Economy and budget,
132419,EU Biodiversity Strategy for 2030: Bringing nature back into our lives,2021-06-08T22:21:23,"Biodiversity, Climate and environment",
133545,The gender dimension in Cohesion Policy,2021-06-08T22:21:23,Gender equality,
131782,The adequate protection of personal data by the United Kingdom,2021-05-21T12:06:26,,
131557,The adequate protection of personal data by the United Kingdom,2021-05-20T11:29:07,,
131764,Prisoners of war in the aftermath of the most recent conflict between Armenia and Azerbaijan,2021-05-20T15:56:55,,
131765,The situation in Haiti,2021-05-20T15:56:55,,
131766,The situation in Chad,2021-05-20T15:56:55,,
131767,Environment: The Aarhus Regulation,2021-05-20T15:56:55,Climate and environment,
131769,Chinese countersanctions on EU entities and MEPs and MPs,2021-05-20T15:56:55,Foreign affairs,
131770,"Data Protection Commissioner v Facebook Ireland Limited, Maximillian Schrems (“Schrems II”) - Case C-311/18",2021-05-20T15:56:55,,
131771,The right of information of the Parliament regarding the ongoing assessment of the national recovery and resilience plans,2021-05-20T15:56:55,,
131772,European Union Agency for Fundamental Rights: interim report,2021-05-20T15:56:55,,
131773,Liability of companies for environmental damage,2021-05-20T15:56:55,Climate and environment,
131774,New Avenues for Legal Labour Migration,2021-05-20T15:56:55,"Migration, Worker’s rights",
131775,Digital future of Europe: digital single market and use of AI for European consumers,2021-05-20T15:56:55,Consumer protection,
131706,Reversing demographic trends in EU regions using cohesion policy instruments,2021-05-19T22:33:43,,
131707,Impacts of EU rules on the free movements of workers and services: intra-EU labour mobility as a tool to match labour market needs and skills,2021-05-19T22:33:43,Worker’s rights,
131708,Accelerating progress and tackling inequalities towards ending AIDS as a public health threat by 2030,2021-05-19T22:33:43,Health,
131710,A European Strategy for Energy System Integration,2021-05-19T15:37:44,Energy,
131711,A European Strategy for Hydrogen,2021-05-19T15:37:44,Energy,
131712,Human rights protection and the EU external migration policy,2021-05-19T15:37:44,Migration,
131713,2019-2020 Reports on Turkey,2021-05-19T15:37:44,Enlargement,
131714,2019-2020 Reports on Montenegro,2021-05-19T15:37:44,Enlargement,
131715,The effects of climate change on human rights and the role of environmental defenders on this matter,2021-05-19T15:37:44,"Climate change, Climate and environment",
131501,Challenges of sports events organisers in the digital environment,2021-05-18T22:38:38,,
131502,Research Fund for Coal and Steel,2021-05-18T22:38:38,,
131503,The impacts of climate change on vulnerable populations in developing countries,2021-05-18T22:38:38,"Climate change, Climate and environment, Foreign affairs",
131518,Amending budget 1/2021: financing the COVID-19 response and including refinements and updates related to the final adoption of the Multiannual Financial Framework,2021-05-18T15:49:46,Economy and budget,
130841,COVID-19 pandemic in Latin America,2021-04-29T15:47:22,"Foreign affairs, Health",
130842,Bolivia and the arrest of former President Jeanine Añez and other officials,2021-04-29T15:47:22,,
130843,"Blasphemy laws in Pakistan, in particular the case Shagufta Kausar and Shafqat Emmanuel",2021-04-29T15:47:22,,
130844,Parliament’s estimates of revenue and expenditure for the financial year 2022,2021-04-29T15:47:22,Economy and budget,
130845,"Russia, the case of Alexei Navalny, military build-up on Ukraine's border and Russian attack in the Czech Republic",2021-04-29T15:47:22,,
130846,5th anniversary of the Peace Agreement in Colombia,2021-04-29T15:47:22,Foreign affairs,
130847,European Child Guarantee,2021-04-29T15:47:22,"Education, youth and culture, Social protection",
