id,title,timestamp,topics,result
153310,Policy Coherence for Development,2023-03-14T12:43:43,Foreign affairs,
153316,"Land use, land use change and forestry (LULUCF)",2023-03-14T12:17:10,"Climate change, Climate and environment, Food and agriculture",
153359,Activities of the European Ombudsman - annual report 2021,2023-03-14T12:42:08,,
153374,Data Act,2023-03-14T12:39:48,Digital,
153485,Energy performance of buildings,2023-03-14T12:35:43,"Energy, Economy and budget",
153629,Revision of the Market Stability Reserve for the EU Emissions Trading System,2023-03-14T12:17:55,"Climate change, Climate and environment",
153640,"The draft Commission implementing decision authorising the placing on the market of products containing, consisting of or produced from genetically modified oilseed rape MON 94100 (MON-941ØØ-2) pursuant to Regulation (EC) No 1829/2003 of the European Parliament and of the Council",2023-03-14T12:14:40,Food and agriculture,
152523,European Central Bank - annual report 2022,2023-02-16T12:52:53,Economy and budget,
152881,Transitional provisions for certain medical devices and in vitro diagnostic medical devices,2023-02-16T12:08:06,,
153055,"Violence against opposition activists in Equatorial Guinea, notably the case of Julio Obama Mefuman",2023-02-16T12:05:24,,
153059,The inhuman imprisonment conditions of Alexei Navalny,2023-02-16T12:06:52,,
153081,One year of Russia’s invasion and war of aggression against Ukraine,2023-02-16T12:48:22,,
153099,The establishment of an independent EU ethics body,2023-02-16T12:43:23,,
153139,Following up on measures requested by Parliament to strengthen the integrity of the European institutions,2023-02-16T12:40:10,,
153265,"An EU strategy to boost industrial competitiveness, trade and quality jobs",2023-02-16T12:30:46,"Worker’s rights, Economy and budget",
152506,Amendments to the European Long-Term Investment Funds (ELTIFs) Regulation,2023-02-15T15:12:49,,
152509,Joint Undertakings under Horizon Europe: Chips Joint Undertaking,2023-02-15T15:15:00,Economy and budget,
152564,Council of Europe Convention on preventing and combating violence against women and domestic violence: EU accession,2023-02-15T15:21:21,Gender equality,
152566,"Protocol to the EC/Korea Cooperation Agreement on a Civil Global Navigation Satellite System (GNSS): accession of Bulgaria, Croatia and Romania",2023-02-15T15:14:40,Economy and budget,
152567,EU/North Macedonia Agreement: operational activities carried out by the European Border and Coast Guard Agency in the Republic of North Macedonia,2023-02-15T15:13:20,Migration,
152568,Authorising Poland to ratify the amendment to the Convention on the Conservation and Management of Pollock Resources in the Central Bering Sea,2023-02-15T15:14:14,Food and agriculture,
152767,Situation of the former President of Georgia Mikheil Saakashvili,2023-02-15T15:16:09,,
152507,Electoral rights of mobile Union citizens in municipal elections,2023-02-14T12:22:02,,
152508,"EU/Guyana Voluntary Partnership Agreement: forest law enforcement, governance and trade in timber products to the EU",2023-02-14T12:19:28,"Climate and environment, International trade, Food and agriculture, Foreign affairs, Biodiversity",
152544,CO2 emission standards for cars and vans,2023-02-14T12:22:51,"Climate and environment, Economy and budget",
152547,Union Secure Connectivity Programme 2023-2027,2023-02-14T12:18:33,,
152552,Electoral rights of mobile Union citizens in European Parliament elections,2023-02-14T12:21:37,,
152554,REPowerEU chapters in recovery and resilience plans,2023-02-14T12:20:08,Energy,
152565,"EU/Guyana Voluntary Partnership Agreement: forest law enforcement, governance and trade in timber products to the EU",2023-02-14T12:19:09,"Climate and environment, International trade, Food and agriculture, Foreign affairs, Biodiversity",
152653,Union's rights in enforcing and implementing the UK Withdrawal Agreement and the EU-UK Trade and Cooperation Agreement,2023-02-14T12:18:10,"Foreign affairs, International trade",
151591,Revision of European Works Councils Directive,2023-02-02T11:26:11,Worker’s rights,
152282,Conservation of the Southern Bluefin Tuna: conservation and management measures,2023-02-02T11:06:16,Food and agriculture,
152302,European system of national and regional accounts in the European Union (ESA 2010),2023-02-02T11:05:49,Economy and budget,
152345,Improving working conditions of persons working through digital labour platforms,2023-02-02T11:11:31,Worker’s rights,
152384,Transparency and targeting of political advertising,2023-02-02T11:16:55,Consumer protection,
152416,The preparation of the EU-Ukraine Summit,2023-02-02T11:31:20,Foreign affairs,
151570,Small-scale fisheries situation in the EU and future perspectives,2023-01-19T12:20:21,Food and agriculture,
151714,The control of the financial activities of the European Investment Bank – Annual Report 2021,2023-01-19T12:14:00,,
151811,The protection of the European Union’s financial interests – combating fraud – annual report 2021,2023-01-19T12:18:56,Economy and budget,
152229,The storming of the Brazilian democratic institutions,2023-01-19T12:05:35,,
152245,The establishment of a tribunal on the crime of aggression against Ukraine,2023-01-19T12:09:45,,
152265,"The situation of journalists in Morocco, notably the case of Omar Radi",2023-01-19T12:07:18,,
151561,Consumer protection in online video games: a European Single Market approach,2023-01-18T12:23:35,Consumer protection,
151701,Implementation of the common foreign and security policy - annual report 2022,2023-01-18T12:38:53,,
151771,Implementation of the common security and defence policy - annual report 2022,2023-01-18T12:48:31,,
151796,Human rights and democracy in the world and the European Union’s policy on the matter - annual report 2022,2023-01-18T12:57:04,,
152032,The 30th anniversary of the single market: celebrating achievements and looking towards future developments,2023-01-18T12:23:13,,
151562,Taxation: rules to prevent the misuse of shell entities for tax purposes,2023-01-17T12:15:21,Taxation,
151578,Shipments of waste,2023-01-17T12:14:13,Climate and environment,
151592,Amendments to Parliament’s Rules of Procedure concerning Rule 7 on defence of privileges and immunity and Rule 9 on procedures on immunity,2023-01-17T12:15:56,,
151821,EU/New Zealand Agreement: exchange of personal data between Europol and New Zealand,2023-01-17T12:10:09,"Foreign affairs, Consumer protection",
151822,Convention on Cybercrime on enhanced co-operation and disclosure of electronic evidence: Second Additional Protocol,2023-01-17T12:10:37,Digital,
150923,Deliberations of the Committee on Petitions in 2021,2022-12-15T12:29:44,,
150935,Upscaling the 2021-2027 Multiannual Financial Framework: a resilient EU budget fit for new challenges,2022-12-15T12:28:40,Economy and budget,
151387,90 years after the Holodomor: recognising the mass killing through starvation as genocide,2022-12-15T12:26:50,,
151460,The case of human rights defender Abdulhadi Al-Khawaja in Bahrain,2022-12-15T12:14:31,,
151508,Suspicions of corruption from Qatar and the broader need for transparency and accountability in the European institutions,2022-12-15T12:26:19,,
150937,"Mobilisation of the European Union Solidarity Fund: assistance to Germany, Belgium, the Netherlands, Austria, Luxembourg, Spain and Greece further to natural disasters that took place in these countries in the course of 2021",2022-12-14T12:34:11,"Climate and environment, Economy and budget",
150954,Implementation of the New European Agenda for Culture and the EU Strategy for International Cultural Relations,2022-12-14T13:08:53,"Education, youth and culture, Foreign affairs",
150983,Annual implementing report on the EU association agreement with Georgia,2022-12-14T12:59:22,"Foreign affairs, International trade",
151046,"Renewable Energy, Energy Performance of Buildings and Energy Efficiency Directives: amendments (REPowerEU)",2022-12-14T12:51:37,"Energy, Economy and budget",
150921,Towards equal rights for people with disabilities,2022-12-13T12:20:57,,
150922,Civil aviation: repealing an obsolete directive,2022-12-13T12:18:50,Climate and environment,
150924,"A long-term Vision for the EU's Rural Areas - Towards stronger, connected, resilient and prosperous rural areas by 2040",2022-12-13T12:21:45,Food and agriculture,
150936,Administrative cooperation in the field of excise duties: exchange of information maintained in the electronic registers concerning economic operators who move excise goods between Member States for commercial purposes,2022-12-13T12:19:12,Taxation,
150939,Notification under the Carbon Offsetting and Reduction Scheme for International Aviation (CORSIA),2022-12-13T12:18:05,"Climate change, Climate and environment",
150940,Action plan to boost long distance and cross border passenger rail,2022-12-13T12:23:37,,
150985,"Application of Articles 93, 107 and 108 of the TFEU to certain categories of State aid in the rail, inland waterway and multimodal transport sector",2022-12-13T12:19:33,Economy and budget,
150992,Transport: repealing obsolete Regulations,2022-12-13T12:18:28,,
151088,"The draft Commission implementing decision renewing the authorisation for the placing on the market of products containing, consisting of or produced from genetically modified soybean A5547-127 (ACS-GMØØ6-4) pursuant to Regulation (EC) No 1829/2003 of the European Parliament and of the Council",2022-12-13T12:19:52,Food and agriculture,
150123,The future European Financial Architecture for Development,2022-11-24T12:13:20,Foreign affairs,
150136,2030 policy programme “Path to the Digital Decade”,2022-11-24T12:07:45,Digital,
150204,Non-recognition of Russian travel documents issued in occupied foreign regions,2022-11-24T12:07:21,Migration,
150407,Multiannual financial framework for the years 2021 to 2027,2022-11-24T12:05:15,Economy and budget,
150545,Establishment of a diversified funding strategy as a general borrowing method,2022-11-24T12:05:32,Economy and budget,
150745,Assessment of Hungary's compliance with the rule of law conditions under the Conditionality Regulation and state of play of the Hungarian RRP,2022-11-24T12:18:37,Economy and budget,
150763,Human rights situation in Egypt,2022-11-24T12:29:01,,
150777,The Human rights situation in Afghanistan especially the deterioration of women’s rights and attacks against educational institutions,2022-11-24T12:10:19,,
150790,Forced displacement of people as a result of escalating conflict in Eastern Democratic Republic of Congo (DRC),2022-11-24T12:13:01,,
150795,'Macro-Financial Assistance+' instrument for providing support to Ukraine for 2023,2022-11-24T12:06:31,,
150815,Outcome of the modernisation of the Energy Charter Treaty,2022-11-24T12:16:12,Energy,
150067,Promoting regional stability and security in the broader Middle East region,2022-11-23T12:27:58,Foreign affairs,
150117,Situation in Libya,2022-11-23T12:26:05,Foreign affairs,
150122,System of own resources of the European Union,2022-11-23T12:08:19,Economy and budget,
150162,New EU strategy for enlargement,2022-11-23T12:17:47,Enlargement,
150265,Amending budget 5/2022: additional measures to address the consequences of the Russian war in Ukraine; Union Civil Protection Mechanism reinforcement; reduction in payment appropriations and update of revenues; other adjustments and technical updates,2022-11-23T12:02:59,Economy and budget,
150459,Recognising the Russian Federation as a state sponsor of terrorism,2022-11-23T12:12:28,Foreign affairs,
150062,Resilience of critical entities,2022-11-22T13:03:18,Digital,
150069,Implementation report on the European Innovation Council,2022-11-22T13:06:53,,
150070,EU/New Zealand Agreement: modification of concessions on all the tariff rate quotas included in the EU Schedule CLXXV,2022-11-22T13:04:54,International trade,
150082,Drivers of certain road vehicles for the carriage of goods or passengers: initial qualification and periodic training. Codification,2022-11-22T13:04:38,,
150126,Common fisheries policy (CFP): restrictions to the access to Union waters,2022-11-22T13:03:38,Food and agriculture,
150133,"The borrowing strategy to finance Next Generation EU, the Union’s Recovery instrument",2022-11-22T13:06:21,Economy and budget,
150134,Protocol to the Euro-Mediterranean Interim Association Agreement: participation of the Palestinian Authority of the West Bank and the Gaza Strip in Union programmes,2022-11-22T13:02:34,"Foreign affairs, International trade",
150138,Decisions of European standardisation organisations,2022-11-22T13:04:12,,
150181,EU/Korea Free Trade Agreement,2022-11-22T13:05:18,International trade,
149822,Digital Finance: Amending Directive regarding Digital Operational Resilience requirements,2022-11-10T11:15:24,,
149824,A high common level of cybersecurity across the Union,2022-11-10T11:16:47,Digital,
149826,Corporate Sustainability Reporting Directive,2022-11-10T11:13:18,Climate and environment,
149827,"Racial justice, non-discrimination and anti-racism in the EU",2022-11-10T11:30:38,,
149829,Digital finance: Digital Operational Resilience Act (DORA),2022-11-10T11:14:57,,
149838,Conclusion of an agreement under GATS on the modification of schedules of specific commitments,2022-11-10T11:08:14,International trade,
149839,EU/Moldova Agreement on the carriage of freight by road,2022-11-10T11:07:48,,
149840,EU/Ukraine Agreement on the carriage of freight by road,2022-11-10T11:07:22,,
149841,Esports and video games,2022-11-10T11:27:18,Consumer protection,
149843,Distortive foreign subsidies,2022-11-10T11:12:40,International trade,
149866,Full application of the provisions of the Schengen acquis in Croatia,2022-11-10T11:25:52,Migration,
149882,REPowerEU chapters in recovery and resilience plans,2022-11-10T11:23:03,Energy,
149479,"The rule of law in Malta, five years after the assassination of Daphne Caruana Galizia",2022-10-20T12:14:04,,
149730,Non-recognition of Russian travel documents issued in occupied foreign regions,2022-10-20T12:08:57,,
149775,Growing hate crimes against LGBTIQ+ people across Europe in light of the recent homophobic murder in Slovakia,2022-10-20T12:19:37,,
148981,Amending budget 4/2022: update of revenue (own resources) and other technical adjustments,2022-10-19T12:07:37,Economy and budget,
149039,Sustainable maritime fuels (FuelEU Maritime Initiative),2022-10-19T12:43:18,"Climate change, Climate and environment, Energy",
149082,Deployment of alternative fuels infrastructure,2022-10-19T13:01:17,Energy,
149194,2023 general budget: all sections,2022-10-19T12:35:22,Economy and budget,
148964,Guidelines for the employment policies of the Member States,2022-10-18T12:13:56,Worker’s rights,
148972,Discharge 2020: European Border and Coast Guard Agency,2022-10-18T12:20:30,Economy and budget,
148976,Discharge 2020: EU general budget - Council and European Council,2022-10-18T12:15:28,Economy and budget,
148987,Discharge 2020: EU general budget - European Economic and Social Committee,2022-10-18T12:17:03,Economy and budget,
149084,Discharge 2020: European Border and Coast Guard Agency,2022-10-18T12:17:40,Economy and budget,
149085,"Objection pursuant to Rule 112 (2) and (3): Active substances, including 8-hydroxyquinoline, chlorotoluron and difenoconazole",2022-10-18T12:21:04,Food and agriculture,
149218,The accession of Romania and Bulgaria to the Schengen area,2022-10-18T12:22:22,Migration,
148762,Temporary relief from the slot utilisation rules at Community airports due to the COVID-19 pandemic,2022-10-06T12:01:10,,
148875,Momentum for the ocean: strengthening ocean governance and biodiversity,2022-10-06T12:23:24,Climate and environment,
148915,Russia’s escalation of its war of aggression against Ukraine,2022-10-06T12:16:23,,
148338,The EU’s strategic relationship and partnership with the Horn of Africa,2022-10-05T12:22:48,Foreign affairs,
148348,Access to water as a human right - the external dimension,2022-10-05T12:24:45,Climate and environment,
148546,Key objectives for the CITES CoP19 meeting in Panama,2022-10-05T12:19:12,"Climate and environment, Biodiversity",
148588,Situation of Roma people living in settlements in the EU,2022-10-05T12:16:19,Social protection,
148302,European Centre for Disease Prevention and Control,2022-10-04T12:03:50,Health,
148304,Serious cross-border threats to health,2022-10-04T12:04:21,Health,
148306,EU Customs Single Window,2022-10-04T12:08:39,International trade,
148308,"Management, conservation and control measures applicable in the Indian Ocean Tuna Commission (IOTC) Area of Competence",2022-10-04T12:06:35,Food and agriculture,
148310,Impact of new technologies on taxation: crypto and blockchain,2022-10-04T12:06:05,Taxation,
148321,Striving for a sustainable and competitive EU aquaculture: the way forward,2022-10-04T12:05:35,"Climate and environment, Food and agriculture",
148323,Radio Equipment Directive: common charger for electronic devices,2022-10-04T12:07:39,"Consumer protection, Health, Economy and budget",
148324,AccessibleEU Centre in support of accessibility policies in the EU internal market,2022-10-04T12:08:14,,
148340,Amending Annexes IV and V to Regulation (EU) 2019/1021 on persistent organic pollutants,2022-10-04T12:12:11,"Climate and environment, Biodiversity",
148344,Statistics on agricultural input and output,2022-10-04T12:11:23,Food and agriculture,
148441,Flexible Assistance to Territories (FAST-CARE),2022-10-04T12:07:07,Migration,
147371,"Economic, social and territorial cohesion in the EU: the 8th Cohesion Report",2022-09-15T12:27:02,,
147372,EU Border Regions: Living labs of European integration,2022-09-15T12:27:49,,
147411,Statute and funding of European political parties and foundations,2022-09-15T12:36:48,Economy and budget,
147456,Existence of a clear risk of a serious breach by Hungary of the values on which the Union is founded,2022-09-15T12:17:35,,
147524,Implementation of the Updated New Industrial Strategy for Europe: aligning spending to policy,2022-09-15T12:38:35,Economy and budget,
148176,Exceptional macro-financial assistance to Ukraine; reinforcement of the Common Provisioning Fund,2022-09-15T12:14:11,,
148240,"The consequences of drought, fire, and other extreme weather phenomena: increasing the EU’s efforts to fight climate change",2022-09-15T12:43:06,"Climate change, Climate and environment",
148243,The situation in the Strait of Taiwan,2022-09-15T12:47:07,,
148245,"Nicaragua, in particular the arrest of the bishop Rolando Álvarez",2022-09-15T12:13:29,,
147342,Adequate minimum wages in the European Union,2022-09-14T13:02:57,"Worker’s rights, Social protection",
147369,Recommendation to the Commission and the Commission Vice President/High Representative of the Union for Foreign Affairs and Security Policy on the Renewed partnership with the Southern Neighbourhood. A new agenda for the Mediterranean,2022-09-14T13:37:36,Foreign affairs,
147521,The New European Bauhaus,2022-09-14T13:38:03,"Climate and environment, Economy and budget",
147557,Energy Efficiency Directive,2022-09-14T13:00:35,Energy,
147705,Renewable Energy Directive,2022-09-14T13:24:15,Energy,
147343,A New EU Forest Strategy for 2030 – Sustainable Forest Management in Europe,2022-09-13T12:17:06,"Biodiversity, Climate and environment, Food and agriculture",
147370,Conservation and enforcement measures applicable in the Regulatory Area of the Northwest Atlantic Fisheries Organisation (NAFO),2022-09-13T12:36:18,Food and agriculture,
147414,Amendments to the Capital Requirements Regulation in the area of resolution (“daisy chain” proposal),2022-09-13T12:08:02,,
147457,"International Sugar Agreement, 1992: amendment",2022-09-13T12:06:46,"International trade, Food and agriculture",
147458,Interim report on the 2021 proposal for a revision of the Multiannual Financial Framework,2022-09-13T12:09:01,Economy and budget,
147459,Amending budget 3/2022: surplus of the financial year 2021,2022-09-13T12:07:35,Economy and budget,
147460,Transport of dangerous goods by road: uniform procedures for checks. Codification,2022-09-13T12:06:28,Climate and environment,
147461,EU/Mauritius Fisheries Partnership Agreement: fishing opportunities and financial contribution 2017-2021. Extension of the Protocol,2022-09-13T12:07:14,Food and agriculture,
147502,Deforestation Regulation,2022-09-13T12:34:34,"Biodiversity, Climate and environment, Food and agriculture",
147522,"The impact of COVID-19 closures of educational, cultural, youth and sports activities on children and young people in the EU",2022-09-13T12:37:22,"Health, Education, youth and culture",
147523,Responsible private funding of litigation,2022-09-13T12:08:29,Consumer protection,
146601,Protection of the EU’s financial interests - combating fraud - annual report 2020,2022-07-07T12:39:28,Economy and budget,
146620,Control of the financial activities of the European Investment Bank - annual report 2020,2022-07-07T12:37:04,,
146626,Better regulation: joining forces to make better laws,2022-07-07T12:40:06,,
146707,Financial activities of the European Investment Bank - annual report 2021,2022-07-07T12:34:33,,
146883,Sustainable aviation fuels (ReFuelEU Aviation Initiative),2022-07-07T12:32:33,"Climate change, Climate and environment, Energy",
147047,Exceptional macro-financial assistance to Ukraine,2022-07-07T12:13:17,,
147230,"The situation of indigenous and environmental defenders in Brazil, including the killing of Dom Phillips and Bruno Pereira",2022-07-07T12:10:51,,
147248,Russia’s invasion of Ukraine: Temporary measures concerning driver documents issued by Ukraine,2022-07-07T12:11:49,,
147261,The situation in Tajikistan’s Gorno-Badakhshan Autonomous Province,2022-07-07T12:11:19,,
147305,US Supreme Court decision to overturn abortion rights in the United States and the need to safeguard abortion rights and Women’s health in the EU,2022-07-07T12:44:55,Gender equality,
146583,2021 Report on Kosovo,2022-07-06T12:31:40,Enlargement,
146585,The EU and the defence of multilateralism,2022-07-06T12:32:36,Foreign affairs,
146605,2021 Report on Serbia,2022-07-06T12:29:30,Enlargement,
146758,"Intersectional discrimination in the European Union: the socio-economic situation of women of African, Middle-Eastern, Latin-American and Asian descent",2022-07-06T12:37:45,"Gender equality, Social protection",
146760,Russia's invasion of Ukraine: Crisis measures in the fisheries and aquaculture sectors,2022-07-06T12:22:04,Food and agriculture,
146836,Addressing food security in developing countries,2022-07-06T12:32:52,Foreign affairs,
146888,Objection pursuant to Rule 111(3): Amending the Taxonomy Climate Delegated Act and the Taxonomy Disclosures Delegated Act,2022-07-06T12:18:21,Climate and environment,
147005,2021 Report on Bosnia and Herzegovina,2022-07-06T12:26:44,Enlargement,
147026,Amendment to Parliament’s Rules of Procedure concerning Rule 216 on committee meetings,2022-07-06T12:17:45,,
147044,National vetoes to undermine the global tax deal,2022-07-06T12:41:59,Economy and budget,
147045,Application of position limits to commodity derivatives and procedures for applying for exemption from position limits,2022-07-06T12:19:47,,
146588,Digital Markets Act,2022-07-05T12:18:51,"Digital, Consumer protection",
146606,Indo-Pacific strategy in the area of trade and investment,2022-07-05T12:27:16,"International trade, Foreign affairs",
146612,EU-India future trade and investment cooperation,2022-07-05T12:27:41,Foreign affairs,
146613,Mental health in the digital world of work,2022-07-05T12:37:10,"Worker’s rights, Health",
146621,Adoption by Croatia of the euro on 1 January 2023,2022-07-05T12:19:23,Economy and budget,
146625,Women’s poverty in Europe,2022-07-05T12:26:16,"Gender equality, Social protection",
146649,Digital Services Act,2022-07-05T12:17:55,Consumer protection,
146661,Banking Union - annual report 2021,2022-07-05T12:38:10,,
146723,Temporary trade liberalisation measures for Moldova,2022-07-05T12:20:17,"Foreign affairs, International trade",
146761,EU/Cook Islands Sustainable Fisheries Partnership Agreement: implementation protocol,2022-07-05T12:19:57,Food and agriculture,
145821,2021 Report on Montenegro,2022-06-23T12:16:10,Enlargement,
145843,Implementation of the Recovery and Resilience Facility,2022-06-23T12:12:16,,
145862,Future of EU international investment policy,2022-06-23T12:16:54,Foreign affairs,
145865,Gas storage,2022-06-23T11:50:01,,
145872,Future of EU-Africa trade relations,2022-06-23T12:16:29,Foreign affairs,
145876,EU Digital COVID Certificate - third-country nationals,2022-06-23T11:54:07,Health,
146052,EC/Brazil Agreement for scientific and technological cooperation: renewal of the Agreement,2022-06-23T11:57:48,,
146053,Convention on the Recognition and Enforcement of Foreign Judgments in Civil or Commercial Matters: accession by the European Union,2022-06-23T11:58:14,,
146303,Mobilisation of the European Globalisation Adjustment Fund: redundancies in the air transport sector in France,2022-06-23T11:55:10,"Worker’s rights, Economy and budget",
146304,Amending budget 2/2022: financing reception costs of people fleeing Ukraine,2022-06-23T11:54:35,Economy and budget,
146307,Mobilisation of the European Globalisation Adjustment Fund: redundancies in the manufacturing of electrical equipment sector in Greece,2022-06-23T11:55:35,"Worker’s rights, Economy and budget",
146315,Objection pursuant to Rule 112(2) and (3): Genetically modified maize NK603 × T25 × DAS-40278-9 and its sub-combination T25 × DAS-40278-9,2022-06-23T11:56:56,Food and agriculture,
146342,Inclusion measures within Erasmus+ 2014-2020,2022-06-23T12:14:23,"Education, youth and culture",
146356,Implementation and delivery of the Sustainable Development Goals,2022-06-23T12:07:38,Foreign affairs,
