id,title,timestamp,topics,result
168016,2022 discharge: EU general budget - European Ombudsman,2024-04-11T12:02:48,Economy and budget,ADOPTED
168054,Inclusion of the right to abortion in the EU Charter of Fundamental Rights,2024-04-11T12:39:05,Gender equality,ADOPTED
168071,2022 discharge: EU general budget - Court of Justice of the European Union,2024-04-11T11:59:13,Economy and budget,ADOPTED
168074,2022 discharge: EU general budget - Commission,2024-04-11T11:26:39,Economy and budget,ADOPTED
168122,2022 discharge: EU general budget - European External Action Service,2024-04-11T12:03:55,Economy and budget,ADOPTED
168154,2022 discharge: EU general budget - European Parliament,2024-04-11T11:38:11,Economy and budget,ADOPTED
168229,"Objection pursuant to Rule 111(3): Specific hygiene requirements for certain meat, fishery products, dairy products and eggs",2024-04-11T11:24:37,"Food and agriculture, Consumer protection, Health",REJECTED
166802,European Criminal Records Information System – third-country nationals,2024-04-10T17:31:45,,ADOPTED
166804,Methane emissions reduction in the energy sector,2024-04-10T17:38:37,Climate and environment,ADOPTED
166844,Union certification framework for carbon removals,2024-04-10T17:42:53,Climate and environment,ADOPTED
166848,Foodstuffs for human consumption: amending certain ‘breakfast’ directives,2024-04-10T17:42:14,"Food and agriculture, Consumer protection",ADOPTED
166850,Amending Directive 2005/35/EC on ship-source pollution and on the introduction of penalties for infringements,2024-04-10T17:47:13,Climate and environment,ADOPTED
166852,European environmental economic accounts: new modules,2024-04-10T17:42:34,"Biodiversity, Climate and environment, Food and agriculture",ADOPTED
166854,Amending Directive 2009/16/EC on port State control,2024-04-10T17:46:52,,ADOPTED
166856,Amending Directive 2013/34/EU as regards the time limits for the adoption of sustainability reporting standards for certain sectors and for certain third-country undertakings,2024-04-10T17:38:15,,ADOPTED
166858,Amending Directive 2009/18/EC establishing the fundamental principles governing the investigation of accidents in the maritime transport sector,2024-04-10T17:44:41,Climate and environment,ADOPTED
166860,Standards for equality bodies in the field of equal treatment and equal opportunities between women and men in matters of employment and occupation,2024-04-10T17:43:21,"Worker’s rights, Gender equality",ADOPTED
166862,"Conservation, management and control measures applicable in the area covered by the NEAFC Convention",2024-04-10T17:44:22,Food and agriculture,ADOPTED
166879,Union procedures for the authorisation and supervision of medicinal products for human use and rules governing the European Medicines Agency,2024-04-10T18:23:15,,ADOPTED
166887,Strengthening the CO2 emission performance targets for new heavy-duty vehicles,2024-04-10T17:41:50,"Climate and environment, Economy and budget",ADOPTED
166904,Screening of third-country nationals at the external borders,2024-04-10T17:31:23,Migration,ADOPTED
166921,"VAT: amendment of the EU-Norway Agreement on administrative cooperation, combating fraud and recovery of claims",2024-04-10T18:14:38,Taxation,ADOPTED
166922,Transfer pricing,2024-04-10T18:17:11,Taxation,ADOPTED
166924,"Mercury: dental amalgam and other mercury-added products subject to manufacturing, import and export restrictions",2024-04-10T17:39:00,"Climate and environment, International trade, Energy",ADOPTED
166925,"Partnership Agreement between the European Union and the Members of the Organisation of African, Caribbean and Pacific States",2024-04-10T18:12:54,"International trade, Foreign affairs",ADOPTED
166929,"Establishment of ‘Eurodac’ for the comparison of fingerprints for the effective application of Regulation (EU) No 604/2013, for identifying an illegally staying third-country national or stateless person and on requests for the comparison with Eurodac data by Member States’ law enforcement authorities and Europol for law enforcement purposes (recast)",2024-04-10T17:32:21,Migration,ADOPTED
166934,"Partnership Agreement between the European Union and the Members of the Organisation of African, Caribbean and Pacific States (resolution)",2024-04-10T18:13:11,"International trade, Foreign affairs",ADOPTED
166936,"Establishing a return border procedure, and amending Regulation (EU) 2021/1148",2024-04-10T17:30:41,Migration,ADOPTED
166939,"Establishing a Head Office Tax system for micro, small and medium-sized enterprises, and amending Directive 2011/16/EU",2024-04-10T18:16:58,,ADOPTED
166959,Accounting of greenhouse gas emissions of transport services,2024-04-10T18:12:28,"Climate change, Climate and environment",ADOPTED
166961,New Regulation on Construction Products,2024-04-10T17:37:51,"Climate and environment, International trade, Economy and budget",ADOPTED
166975,Union code relating to medicinal products for human use,2024-04-10T18:19:34,,ADOPTED
166979,Addressing situations of crisis and force majeure,2024-04-10T17:29:31,Migration,ADOPTED
167003,Laying down additional procedural rules relating to the enforcement of Regulation (EU) 2016/679,2024-04-10T17:36:34,Consumer protection,ADOPTED
167007,Standards for the reception of applicants for international protection (recast),2024-04-10T17:34:43,Migration,ADOPTED
167031,"Agreement between the European Union and Iceland on supplementary rules in relation to the instrument for financial support for border management and visa policy, as part of the Integrated Border Management Fund",2024-04-10T18:14:53,"Foreign affairs, Migration",ADOPTED
167033,"Agreement between the European Union and the Swiss Confederation on supplementary rules in relation to the instrument for financial support for border management and visa policy, as part of the Integrated Border Management Fund",2024-04-10T18:15:22,"Foreign affairs, Migration",ADOPTED
167034,Agreement in the form of an Exchange of Letters between the European Union and the Argentine Republic amending the Agreement of the European Union and the Argentine Republic pursuant to Article XXVIII of the General Agreement on Tariffs and Trade (GATT) 1994 relating to the modification of concessions on all the tariff-rate quotas included in the EU Schedule CLXXV as a consequence of the United Kingdom’s withdrawal from the European Union,2024-04-10T18:14:19,International trade,ADOPTED
167076,Amendments to Parliament’s Rules of Procedure implementing the parliamentary reform ‘Parliament 2024’,2024-04-10T17:24:32,,ADOPTED
167328,Amending Directive 2009/21/EC on compliance with flag State requirements,2024-04-10T17:47:33,,ADOPTED
167343,"Agreement between the European Union and the Kingdom of Norway on supplementary rules in relation to the instrument for financial support for border management and visa policy, as part of the Integrated Border Management Fund",2024-04-10T18:15:08,"Foreign affairs, Migration",ADOPTED
167351,"EU/Côte d’Ivoire Voluntary Partnership Agreement: forest law enforcement, governance and trade in timber and timber products to the EU (resolution)",2024-04-10T18:13:46,"Climate and environment, International trade, Food and agriculture, Foreign affairs, Biodiversity",ADOPTED
167357,Standards for the qualification of third-country nationals or stateless persons as beneficiaries of international protection,2024-04-10T17:34:07,Migration,ADOPTED
167405,"EU/Côte d’Ivoire Voluntary Partnership Agreement: forest law enforcement, governance and trade in timber and timber products to the EU",2024-04-10T18:13:29,"Climate and environment, International trade, Food and agriculture, Foreign affairs, Biodiversity",ADOPTED
167417,Agreement in the form of an Exchange of Letters between the European Union and the Arab Republic of Egypt pursuant to Article XXVIII of the General Agreement on Tariffs and Trade (GATT) 1994 relating to the modification of concessions on all the tariff rate quotas included in the EU Schedule CLXXV as a consequence of the United Kingdom’s withdrawal from the European Union,2024-04-10T18:14:02,International trade,ADOPTED
167486,Soil Monitoring and Resilience (Soil Monitoring Directive),2024-04-10T18:09:11,"Climate and environment, Biodiversity",ADOPTED
167531,Asylum and migration management,2024-04-10T17:30:16,Migration,ADOPTED
167632,Common procedure for international protection in the Union,2024-04-10T17:25:22,Migration,ADOPTED
167680,Urban wastewater treatment,2024-04-10T18:23:36,Climate and environment,ADOPTED
167683,Union Resettlement Framework,2024-04-10T17:33:12,Migration,ADOPTED
167712,Temporary derogation: combating online child sexual abuse,2024-04-10T17:44:00,Digital,ADOPTED
167902,"Conclusion of an Agreement between the European Union, of the one part, and the Republic of Armenia, of the other part, on cooperation between the European Union Agency for Criminal Justice Cooperation (Eurojust) and the competent authorities for judicial cooperation in criminal matters of the Republic of Armenia",2024-04-10T18:16:23,,ADOPTED
167979,Amendments to Parliament’s Rules of Procedure implementing the parliamentary reform ‘Parliament 2024’,2024-04-10T17:24:13,,ADOPTED
166023,Financial rules applicable to the general budget of the Union (recast),2024-03-14T12:20:14,Economy and budget,ADOPTED
166081,Industrial property: legal protection of designs (recast),2024-03-14T12:23:44,,ADOPTED
166085,Industrial property: protection of Community designs,2024-03-14T12:23:19,,ADOPTED
166087,Cohesion policy 2014-2020 – implementation and outcomes in the Member States,2024-03-14T12:39:19,,ADOPTED
166242,"Reporting requirements in the fields of food and food ingredients, outdoor noise, patients’ rights, and radio equipment",2024-03-14T12:24:37,"Climate and environment, Food and agriculture, Consumer protection, Health",ADOPTED
166243,Reporting requirements for infrastructures for spatial information,2024-03-14T12:24:07,Climate and environment,ADOPTED
166261,Agreement between the European Union and the Republic of Albania on operational activities carried out by the European Border and Coast Guard Agency in the Republic of Albania,2024-03-14T12:25:41,Migration,ADOPTED
166299,Protocol amending the Agreement between the European Union and Japan for an Economic Partnership,2024-03-14T12:25:06,International trade,ADOPTED
166609,The time the European Commission takes to deal with requests for public access to documents,2024-03-14T12:36:48,,ADOPTED
166653,Subscription by the Union to additional shares in the capital of the EBRD and amendment of the Agreement establishing the EBRD,2024-03-14T12:19:29,,ADOPTED
166706,"The case of Rocío San Miguel and General Hernández Da Costa, among other political prisoners in Venezuela",2024-03-14T12:18:47,,ADOPTED
166745,"The repressive environment in Afghanistan, including public executions and violence against women",2024-03-14T12:18:21,Gender equality,ADOPTED
166777,The immediate risk of mass starvation in Gaza and the attacks on humanitarian aid deliveries,2024-03-14T12:16:03,Foreign affairs,ADOPTED
166019,European Semester for economic policy coordination 2024,2024-03-13T17:21:02,Economy and budget,ADOPTED
166034,Minimum requirements on minimum breaks and daily and weekly rest periods in the occasional passenger transport sector,2024-03-13T12:36:33,Worker’s rights,ADOPTED
166049,"Establishing the Union Customs Code and the European Union Customs Authority, and repealing Regulation (EU) No 952/2013",2024-03-13T12:39:44,International trade,ADOPTED
166051,Artificial Intelligence Act,2024-03-13T12:14:17,Economy and budget,ADOPTED
166079,Amending Regulation (EC) No 223/2009 on European statistics,2024-03-13T12:40:11,,ADOPTED
166083,Amending the Directive on alternative dispute resolution for consumer disputes,2024-03-13T12:14:52,"Travel, Consumer protection",ADOPTED
166086,Discontinuation of the European ODR Platform,2024-03-13T12:16:34,"Digital, Consumer protection",ADOPTED
166089,Asset recovery and confiscation,2024-03-13T12:18:56,,ADOPTED
166131,Guidelines for the 2025 Budget – Section III,2024-03-13T17:43:14,Economy and budget,ADOPTED
166145,European Semester for economic policy coordination: employment and social priorities for 2024,2024-03-13T17:30:50,"Worker’s rights, Economy and budget",REJECTED
166171,Safety of toys and repealing Directive 2009/48/EC,2024-03-13T12:31:37,Consumer protection,ADOPTED
166172,A single application procedure for a single permit for third-country nationals to reside and work in the territory of a Member State and a common set of rights for third-country workers legally residing in a Member State (recast),2024-03-13T12:34:04,"Migration, Worker’s rights",ADOPTED
166175,Type-approval of motor vehicles and engines with respect to their emissions and battery durability (Euro 7),2024-03-13T17:04:16,"Climate and environment, Economy and budget",ADOPTED
166183,European Media Freedom Act,2024-03-13T12:13:46,,ADOPTED
166202,Compulsory licensing for crisis management and amending Regulation (EC) 816/2006,2024-03-13T12:21:46,Health,ADOPTED
166241,Amending Directive 2008/98/EC on waste,2024-03-13T12:33:41,Climate and environment,ADOPTED
166258,Reporting requirements in the fields of road transport and aviation: decision,2024-03-13T12:35:20,"Climate and environment, Energy, Economy and budget",ADOPTED
166259,Reporting requirements in the fields of road transport and aviation: regulation,2024-03-13T12:34:57,,ADOPTED
166260,Use of the Internal Market Information System and the Single Digital Gateway for the purposes of certain requirements laid down by the Directive on European cross-border associations,2024-03-13T12:19:21,,ADOPTED
166262,European cross-border associations,2024-03-13T12:34:35,,ADOPTED
166335,Temporary trade-liberalisation measures supplementing trade concessions applicable to Moldovan products under the EU/Euratom/Moldova Association Agreement,2024-03-13T17:15:44,"Enlargement, Foreign affairs, International trade",ADOPTED
166551,Temporary trade-liberalisation measures supplementing trade concessions applicable to Ukrainian products under the EU/Euratom/Ukraine Association Agreement,2024-03-13T17:12:52,"Enlargement, Foreign affairs, International trade",ADOPTED
166566,Closer ties between the EU and Armenia and the need for a peace agreement between Azerbaijan and Armenia,2024-03-13T17:46:51,Foreign affairs,ADOPTED
166038,Energy performance of buildings (recast),2024-03-12T13:30:58,"Energy, Economy and budget",ADOPTED
166040,Amending Regulation (EU) 2019/1009 as regards the digital labelling of EU fertilising products,2024-03-12T13:41:38,"Climate and environment, Food and agriculture, Biodiversity",ADOPTED
166053,Liability for defective products,2024-03-12T13:41:14,Consumer protection,ADOPTED
166073,Weights and dimensions of certain road vehicles,2024-03-12T13:24:43,Economy and budget,ADOPTED
166077,Definition of criminal offences and penalties for the violation of Union restrictive measures,2024-03-12T13:15:38,,ADOPTED
166082,Amending certain financial services and investment support regulations as regards certain reporting requirements,2024-03-12T13:30:08,,ADOPTED
166133,Industrial Emissions Portal,2024-03-12T13:15:01,"Climate and environment, Consumer protection",ADOPTED
166146,European Maritime Safety Agency and repealing Regulation (EC) No 1406/2002,2024-03-12T13:41:59,,ADOPTED
166177,Horizontal cybersecurity requirements for products with digital elements and amending Regulation (EU) 2019/1020,2024-03-12T13:33:13,"International trade, Consumer protection, Digital",ADOPTED
166226,Substantiation and communication of explicit environmental claims (Green Claims Directive),2024-03-12T13:40:42,Consumer protection,ADOPTED
166227,"Use of railway infrastructure capacity in the single European railway area, amending Directive 2012/34/EU and repealing Regulation (EU) No 913/2010",2024-03-12T13:27:29,,ADOPTED
166228,"Council decision inviting Member States to ratify the Violence and Harassment Convention, 2019 (No 190) of the International Labour Organization",2024-03-12T13:42:26,"Gender equality, Foreign affairs, Worker’s rights",ADOPTED
166249,Industrial Emissions Directive,2024-03-12T13:14:11,"Climate and environment, Economy and budget",ADOPTED
166379,Objection pursuant to Rule 111(3): Union list of projects of common interest and projects of mutual interest,2024-03-12T13:07:48,Energy,REJECTED
164580,Improving the Union’s protection against market manipulation on the wholesale energy market,2024-02-29T12:11:40,"Economy and budget, Energy",ADOPTED
164581,Implementation of the EU-Southern African Development Community (SADC) Economic Partnership Agreement (EPA),2024-02-29T12:25:50,"Foreign affairs, International trade",ADOPTED
164582,Deepening EU integration in view of future enlargement,2024-02-29T12:23:02,Enlargement,ADOPTED
164584,Data collection and sharing relating to short-term accommodation rental services,2024-02-29T12:04:55,Travel,ADOPTED
164795,EU/Chile Advanced Framework Agreement,2024-02-29T12:05:38,"Foreign affairs, International trade",ADOPTED
164796,Conclusion of an Agreement between the European Union and the Republic of Seychelles on access for Seychelles fishing vessels to the waters of Mayotte,2024-02-29T12:04:33,Food and agriculture,ADOPTED
164797,Interim Agreement on Trade between the European Union and the Republic of Chile,2024-02-29T12:05:18,"Foreign affairs, International trade",ADOPTED
164961,"Economic Partnership Agreement between the European Union of the one part, and Republic of Kenya, Member of the East African Community of the other part",2024-02-29T12:04:10,International trade,ADOPTED
165939,The murder of Alexei Navalny and the need for EU action in support of political prisoners and oppressed civil society in Russia,2024-02-29T12:14:59,,ADOPTED
165965,"The need for unwavering EU support for Ukraine, after two years of Russia’s war of aggression against Ukraine",2024-02-29T12:19:52,,ADOPTED
165987,Critical situation in Cuba,2024-02-29T12:29:44,,ADOPTED
165988,EU/Chile Advanced Framework Agreement (resolution),2024-02-29T12:08:46,"Foreign affairs, International trade",ADOPTED
165993,European Digital Identity Framework,2024-02-29T12:12:53,"Digital, Consumer protection",ADOPTED
164524,Financial activities of the European Investment Bank - annual report 2023,2024-02-28T18:20:52,,ADOPTED
164530,Faster and Safer Relief of Excess Withholding Taxes,2024-02-28T13:01:55,Taxation,ADOPTED
164532,"Geographical Indications for wine, spirit drinks and agricultural products",2024-02-28T13:00:04,"Food and agriculture, Consumer protection",ADOPTED
164555,Report on the Commission’s 2023 Rule of Law report,2024-02-28T18:25:54,,ADOPTED
164578,Ongoing negotiations on a status agreement on operational activities carried out by the European Border and Coast Guard Agency (Frontex) in Senegal,2024-02-28T13:12:58,Migration,REJECTED
164600,Supplementary protection certificate for medicinal products (recast),2024-02-28T12:51:57,Health,ADOPTED
164601,Reporting requirements,2024-02-28T13:02:12,"Food and agriculture, Economy and budget",ADOPTED
164605,Supplementary protection certificate for plant protection products (recast),2024-02-28T12:51:22,Food and agriculture,ADOPTED
164612,Unitary supplementary certificate for medicinal products,2024-02-28T12:50:45,Health,ADOPTED
164659,Human rights and democracy in the world and the European Union’s policy on the matter – annual report 2023,2024-02-28T18:18:48,,ADOPTED
164705,Unitary supplementary protection certificate for plant protection products,2024-02-28T12:49:40,Food and agriculture,ADOPTED
164794,Implementation of the common security and defence policy – annual report 2023,2024-02-28T18:05:57,,ADOPTED
164839,"Recommendation to the Council, the Commission and the EEAS on the situation in Syria",2024-02-28T18:31:23,,ADOPTED
164958,Implementation of the common foreign and security policy – annual report 2023,2024-02-28T17:48:05,,ADOPTED
165088,Driving licences,2024-02-28T12:46:58,,ADOPTED
165167,Standard essential patents,2024-02-28T12:59:42,,ADOPTED
164462,Protection of the environment through criminal law,2024-02-27T12:31:38,Climate and environment,ADOPTED
164464,Transparency and targeting of political advertising,2024-02-27T12:30:08,Consumer protection,ADOPTED
164466,Amendments to Protocol No 3 on the Statute of the Court of Justice,2024-02-27T12:23:28,,ADOPTED
164468,Certain aspects of the minimum requirement for own funds and eligible liabilities,2024-02-27T12:26:42,,ADOPTED
164486,European Central Bank – annual report 2023,2024-02-27T12:35:39,Economy and budget,ADOPTED
164487,Detergents and surfactants,2024-02-27T12:30:36,"Climate and environment, International trade, Consumer protection, Economy and budget",ADOPTED
164489,Establishing the Strategic Technologies for Europe Platform (‘STEP’),2024-02-27T12:16:17,Economy and budget,ADOPTED
164491,Amending Decision (EU) 2017/1324: continuation of the Union’s participation in PRIMA under Horizon Europe,2024-02-27T12:31:09,,ADOPTED
164493,Shipments of waste,2024-02-27T12:26:12,Climate and environment,ADOPTED
164499,Nature restoration,2024-02-27T12:28:30,"Climate and environment, Biodiversity",ADOPTED
164515,Protection of journalists and human rights defenders from manifestly unfounded or abusive court proceedings,2024-02-27T12:20:41,,ADOPTED
164536,Establishing the Ukraine Facility,2024-02-27T12:15:13,Foreign affairs,ADOPTED
164815,Multiannual financial framework for the years 2021 to 2027,2024-02-27T12:07:45,Economy and budget,ADOPTED
165216,Multiannual financial framework for the years 2021 to 2027 (resolution),2024-02-27T12:14:42,Economy and budget,ADOPTED
163742,Automated data exchange for police cooperation (‘Prüm II’),2024-02-08T12:08:04,,ADOPTED
164215,Implementation report on the EU LGBTIQ Equality Strategy 2020-2025,2024-02-08T12:19:19,,ADOPTED
164378,New wave of mass arrests in Belarus of opposition activists and their family members,2024-02-08T12:03:28,,ADOPTED
164381,Further repression against the democratic forces in Venezuela: attacks on presidential candidate María Corina Machado,2024-02-08T12:32:26,,ADOPTED
164395,Situation in Serbia following the elections,2024-02-08T12:16:12,,ADOPTED
164439,Russiagate: allegations of Russian interference in the democratic processes of the European Union,2024-02-08T12:31:44,,ADOPTED
163746,Instant payments in euro,2024-02-07T12:55:49,Economy and budget,ADOPTED
163752,Amendments to the Alternative Investment Fund Managers Directive (AIFMD) and to the Directive relating to undertakings for collective investment in transferable securities (UCITSD),2024-02-07T12:55:27,,ADOPTED
163753,"Empowering the French Republic to negotiate, sign and conclude an international agreement on the safety and interoperability requirements within the Channel Fixed Link",2024-02-07T12:52:39,,ADOPTED
163767,Limit values for lead and its inorganic compounds and diisocyanates,2024-02-07T12:56:12,Worker’s rights,ADOPTED
164047,Plants obtained by certain new genomic techniques and their food and feed,2024-02-07T13:32:49,"Food and agriculture, Consumer protection",ADOPTED
164065,Conclusion of the Sustainable Investment Facilitation Agreement between the European Union and the Republic of Angola,2024-02-07T12:55:08,,ADOPTED
164216,Temporary derogation: combating online child sexual abuse,2024-02-07T12:52:16,Digital,ADOPTED
164218,Norway’s recent decision to advance seabed mining in the Arctic,2024-02-07T13:34:43,"Biodiversity, Climate and environment",ADOPTED
164220,Rule of law and media freedom in Greece,2024-02-07T13:35:30,,ADOPTED
163744,Measures for a high level of public sector interoperability across the Union (Interoperable Europe Act),2024-02-06T13:00:35,,ADOPTED
163748,Waste electrical and electronic equipment (WEEE),2024-02-06T13:00:05,"Climate and environment, Economy and budget",ADOPTED
163750,"Amendments to the regulation on management, conservation and control measures applicable in the ICCAT Convention Area and the regulation on a multiannual management plan for bluefin tuna in the eastern Atlantic and the Mediterranean",2024-02-06T13:03:33,Food and agriculture,ADOPTED
163765,Union-wide effect of certain driving disqualifications,2024-02-06T12:58:59,,ADOPTED
163769,"Amending Council Decision 2009/917/JHA, as regards its alignment with Union rules on the protection of personal data",2024-02-06T12:59:37,,ADOPTED
162202,Extending the list of EU crimes to hate speech and hate crime,2024-01-18T12:20:54,,ADOPTED
162968,Implementation of the Common Fisheries Policy and future perspectives,2024-01-18T12:24:26,Food and agriculture,ADOPTED
163021,"Shaping the EU’s position on the UN binding instrument on business and human rights, in particular on access to remedy and the protection of victims",2024-01-18T12:18:28,Foreign affairs,ADOPTED
163054,Impact of illegal fishing on food security  – the role of the European Union,2024-01-18T12:18:43,"Climate and environment, Foreign affairs, Biodiversity, Food and agriculture",ADOPTED
163055,Geothermal energy,2024-01-18T12:33:53,Energy,ADOPTED
163056,Gender aspects of the rising cost of living and the impact of the energy crisis,2024-01-18T12:33:34,"Economy and budget, Energy, Social protection, Gender equality",ADOPTED
163061,Implementation of the Common Market Organisation (CMO) Regulation in fisheries and aquaculture – Regulation (EU) No 1379/2013,2024-01-18T12:30:03,Food and agriculture,ADOPTED
163070,Protection of the European Union’s financial interests – combating fraud – annual report 2022,2024-01-18T12:17:04,Economy and budget,ADOPTED
163093,EU Action Plan: protecting and restoring marine ecosystems for sustainable and resilient fisheries,2024-01-18T12:28:30,"Climate and environment, Biodiversity, Food and agriculture",ADOPTED
