id,title,timestamp,topics,result
183021,Drones and new systems of warfare – the EU’s need to adapt to be fit for today’s security challenges,2026-01-22T12:06:20,,ADOPTED
183057,Choice of performance indicators for audit and budgetary control in the context of financing measures to support the implementation of future European competitiveness,2026-01-22T12:08:01,"Climate change, Economy and budget, Climate and environment",ADOPTED
183177,European technological sovereignty and digital infrastructure,2026-01-22T12:12:03,,ADOPTED
183538,Motion of censure on the Commission,2026-01-22T12:02:45,,REJECTED
184027,Brutal repression against protesters in Iran,2026-01-22T12:15:26,,ADOPTED
184065,Attempted takeover of Lithuania’s public broadcaster and the threat to democracy in Lithuania,2026-01-22T12:21:32,,ADOPTED
184066,Case of Joseph Figueira Martin in the Central African Republic,2026-01-22T12:05:06,Foreign affairs,ADOPTED
184067,Conviction and imminent sentencing of Jimmy Lai in Hong Kong,2026-01-22T12:05:36,,ADOPTED
183058,EU-Bosnia and Herzegovina Agreement on operational activities carried out by the European Border and Coast Guard Agency in Bosnia and Herzegovina,2026-01-21T12:50:38,Migration,ADOPTED
183107,Human rights and democracy in the world and the European Union’s policy on the matter – annual report 2025,2026-01-21T13:45:57,,ADOPTED
183108,"Addressing impunity through EU sanctions, including the EU Global Human Rights sanctions regime (so-called “EU Magnitsky Act”)",2026-01-21T13:48:38,,ADOPTED
183225,Implementation of the common security and defence policy – annual report 2025,2026-01-21T13:30:24,,ADOPTED
183397,Implementation of the common foreign and security policy – annual report 2025,2026-01-21T13:17:11,,ADOPTED
183884,Request for opinion from the Court of Justice on the compatibility with the Treaties of the proposed EU-Mercosur Partnership Agreement (EMPA) and Interim Trade Agreement (ITA),2026-01-21T12:48:35,"International trade, Foreign affairs",ADOPTED
183885,Request for opinion from the Court of Justice on the compatibility with the Treaties of the proposed EU-Mercosur Partnership Agreement (EMPA) and Interim Trade Agreement (ITA),2026-01-21T12:49:21,"International trade, Foreign affairs",REJECTED
183022,Safeguarding and promoting financial stability amid economic uncertainties,2026-01-20T13:10:28,,ADOPTED
183050,"Framework for strengthening the availability and security of supply of critical medicinal products as well as the availability of, and accessibility of, medicinal products of common interest",2026-01-20T12:51:16,Health,ADOPTED
183122,Just transition directive in the world of work: ensuring the creation of jobs and revitalising local economies,2026-01-20T13:09:57,,ADOPTED
183124,Humanitarian aid in a time of polycrisis – reaffirming our principles for a more effective and ambitious response to humanitarian crises,2026-01-20T13:11:20,Foreign affairs,ADOPTED
183160,The 28th Regime: a new legal framework for innovative companies,2026-01-20T12:57:48,,ADOPTED
183166,Reform of the European Electoral Act – hurdles to ratification and implementation in the Member States,2026-01-20T13:16:41,,ADOPTED
183244,"Framework for strengthening the availability and security of supply of critical medicinal products as well as the availability of, and accessibility of, medicinal products of common interest",2026-01-20T12:43:04,Health,REJECTED
182388,"Decarbonisation and modernisation of EU fisheries, and the development and deployment of fishing gear",2025-12-18T12:20:25,"Climate and environment, Food and agriculture",ADOPTED
182506,Implementation of the rule of law conditionality regime,2025-12-18T12:16:09,,ADOPTED
182922,Continuous Belarusian hybrid attacks against Lithuania,2025-12-18T12:24:07,,ADOPTED
182962,Arbitrary arrest and sentencing of academics Bahruz Samadov and Igbal Abilov in Azerbaijan,2025-12-18T12:04:13,,ADOPTED
182963,Grave political situation in Guinea-Bissau after the coup of 26 November,2025-12-18T12:07:58,,ADOPTED
182968,"Mass kidnapping of children in Nigeria, including from St Mary’s Catholic School in Papiri",2025-12-18T12:07:13,,ADOPTED
182462,European High Performance Computing Joint Undertaking (EuroHPC),2025-12-17T12:27:51,,ADOPTED
182510,European Defence Readiness 2030: assessment of needs,2025-12-17T12:30:33,Economy and budget,ADOPTED
182511,Military Mobility,2025-12-17T12:29:28,,ADOPTED
182512,EU/Jordan Agreement for scientific and technological cooperation: terms and conditions for the participation of Jordan in the Partnership for Research and Innovation in the Mediterranean Area (PRIMA),2025-12-17T12:27:28,,ADOPTED
182704,Objection pursuant to Rule 114(3): Simplification of the content and presentation of information to be disclosed concerning environmentally sustainable activities and simplification of certain technical screening criteria for determining whether economic activities cause no significant harm to environmental objectives,2025-12-17T12:28:58,Climate and environment,REJECTED
182713,"European Citizens’ Initiative ‘My voice, my choice: for safe and accessible abortion’",2025-12-17T12:37:34,Gender equality,REJECTED
182767,"European Citizens’ Initiative ‘My voice, my choice: for safe and accessible abortion’",2025-12-17T12:47:49,Gender equality,ADOPTED
182797,"Digitalisation, artificial intelligence and algorithmic management in the workplace – shaping the future of work",2025-12-17T12:34:17,,ADOPTED
182807,"Phasing out Russian natural gas imports, improving monitoring of potential energy dependencies",2025-12-17T12:24:21,"International trade, Energy",ADOPTED
182885,Deforestation Regulation: certain obligations of operators and traders,2025-12-17T12:25:21,"Biodiversity, Climate and environment, Food and agriculture",REJECTED
182886,Deforestation Regulation: certain obligations of operators and traders,2025-12-17T12:25:40,"Biodiversity, Climate and environment, Food and agriculture",ADOPTED
182887,"Phasing out Russian natural gas imports, improving monitoring of potential energy dependencies",2025-12-17T12:24:01,"International trade, Energy",REJECTED
182895,Establishment of a list of safe countries of origin at Union level,2025-12-17T12:23:20,Migration,ADOPTED
182896,Application of the ‘safe third country’ concept,2025-12-17T12:22:43,Migration,ADOPTED
182460,Bilateral safeguard clause of the EU-Mercosur Partnership Agreement and the EU-Mercosur Interim Trade Agreement for agricultural products,2025-12-16T13:01:18,"International trade, Foreign affairs",ADOPTED
182463,Brexit Adjustment Reserve,2025-12-16T13:10:37,Economy and budget,ADOPTED
182470,Mobilisation of the European Globalisation Adjustment Fund for Displaced Workers: application EGF/2025/003 SE/Northvolt – Sweden,2025-12-16T13:12:40,"Worker’s rights, Economy and budget",ADOPTED
182479,Providing macro-financial assistance to Jordan,2025-12-16T13:10:16,Foreign affairs,ADOPTED
182483,Incentivising defence-related investments in the EU budget to implement the ReArm Europe Plan,2025-12-16T13:07:56,Economy and budget,ADOPTED
182509,"Amending certain CAP Regulations as regards the conditionality system, types of intervention in the form of direct payment, types of intervention in certain sectors and rural development and annual performance reports, data and interoperability governance, suspensions of payments annual performance clearance and controls and penalties",2025-12-16T13:08:20,Food and agriculture,ADOPTED
182518,Corporate sustainability reporting and due diligence requirements,2025-12-16T13:11:37,Climate and environment,ADOPTED
182614,Corporate sustainability reporting and due diligence requirements,2025-12-16T13:11:05,Climate and environment,REJECTED
182645,Relations between the EU and Saudi Arabia,2025-12-16T13:14:14,,ADOPTED
182703,Objection pursuant to Rule 115(2) and (3): Genetically modified maize NK603,2025-12-16T13:14:34,"Food and agriculture, Consumer protection",ADOPTED
182705,Objection pursuant to Rule 115(2) and (3): Genetically modified sugar beet KWS20-1,2025-12-16T13:15:02,Food and agriculture,ADOPTED
181486,Implementation of the EU-UK Trade and Cooperation Agreement,2025-11-27T12:17:35,"Foreign affairs, International trade",ADOPTED
181550,EU strategy for the rights of persons with disabilities post-2024,2025-11-27T12:25:39,,ADOPTED
181559,Harmonised requirements in the internal market on transparency of third countries interest representation,2025-11-27T12:09:23,,ADOPTED
181561,Amending Regulations on the Internal Market Information System (IMI) and on the single digital gateway as regards certain harmonisation requirements on transparency,2025-11-27T12:06:41,,ADOPTED
181566,Application of the Treaty provisions related to the principles of subsidiarity and proportionality and the role of national parliaments in the EU legislative process,2025-11-27T12:27:37,,ADOPTED
182257,Political situation in Myanmar including the humanitarian crisis of the Rohingya,2025-11-27T12:34:44,Foreign affairs,ADOPTED
182288,Escalation of the war and the humanitarian catastrophe in Sudan,2025-11-27T12:34:09,,ADOPTED
182293,"Rule of law and human rights situation in Tunisia, particularly the case of Sonia Dahmani",2025-11-27T12:06:16,,ADOPTED
182305,"Post-election killings and the deteriorating human rights situation in Tanzania, including the case of imprisoned opposition leader Tundu Lissu",2025-11-27T12:03:55,,ADOPTED
182317,Escalating repression of the Baha’is in Iran,2025-11-27T12:05:15,,ADOPTED
182353,EU position on the proposed plan and EU engagement towards a just and lasting peace for Ukraine,2025-11-27T12:40:52,,ADOPTED
181492,EU’s diplomatic strategy and geopolitical cooperation in the Arctic,2025-11-26T12:34:56,Foreign affairs,ADOPTED
181520,Protection of minors online,2025-11-26T12:39:11,,ADOPTED
181522,Increasing the efficiency of the EU guarantee under the InvestEU Regulation and simplifying reporting requirements,2025-11-26T12:30:40,Economy and budget,ADOPTED
181544,Access to finance for SMEs and scale-ups,2025-11-26T12:41:47,,ADOPTED
181563,Collection of statistical information by the European Central Bank,2025-11-26T12:31:03,Economy and budget,ADOPTED
181633,2026 budgetary procedure: joint text,2025-11-26T12:08:59,Economy and budget,ADOPTED
181813,Deforestation Regulation: certain obligations of operators and traders,2025-11-26T12:29:21,"Biodiversity, Climate and environment, Food and agriculture",ADOPTED
181885,Deforestation Regulation: certain obligations of operators and traders,2025-11-26T12:12:36,"Biodiversity, Climate and environment, Food and agriculture",REJECTED
181950,Objection pursuant to Rule 114(3): amending Delegated Regulation (EU) 2023/2429 as regards origin labelling for fruit and vegetables originating in the non-self-governing territory of Western Sahara,2025-11-26T12:51:01,Food and agriculture,REJECTED
181951,Objection pursuant to Rule 114(3): amending Delegated Regulation (EU) 2023/2429 as regards origin labelling for fruit and vegetables originating in the non-self-governing territory of Western Sahara,2025-11-26T12:52:37,Food and agriculture,REJECTED
181953,Objection pursuant to Rule 114(3): amending Delegated Regulation (EU) 2020/1818 as regards the definition of prohibited weapons,2025-11-26T12:49:09,Economy and budget,REJECTED
181994,"Draft amending budget No 3/2025: adjustment in payment appropriations, update of revenues and other technical updates",2025-11-26T12:08:32,Economy and budget,ADOPTED
182008,"Protecting EU consumers against the practices of certain e-commerce platforms: the case of child-like sex dolls, weapons and other illegal products and material",2025-11-26T12:42:23,"Consumer protection, Digital",REJECTED
181511,Existence of a clear risk of a serious breach by Hungary of the values on which the Union is founded,2025-11-25T12:41:38,,ADOPTED
181542,Institutional aspects of the report on the future of European competitiveness (Draghi Report),2025-11-25T12:49:38,Economy and budget,ADOPTED
181551,Impact of artificial intelligence on the financial sector,2025-11-25T12:51:56,,ADOPTED
181564,Ensuring faster registration and uptake of biological control agents,2025-11-25T12:42:26,"Climate and environment, Food and agriculture",ADOPTED
181587,European Defence Industry Programme and a framework of measures to ensure the timely availability and supply of defence products (‘EDIP’),2025-11-25T12:29:35,Economy and budget,ADOPTED
181617,2024 budget: assessing the implementation of the gender mainstreaming methodology in the EU budget,2025-11-25T12:58:08,"Gender equality, Economy and budget",ADOPTED
181829,Objection pursuant to Rule 115(2) and (3): Genetically modified maize DAS1131,2025-11-25T12:58:40,Food and agriculture,ADOPTED
181830,Objection pursuant to Rule 115(2) and (3): Genetically modified oilseed rape MON 88302,2025-11-25T12:59:30,Food and agriculture,ADOPTED
181831,Objection pursuant to Rule 115(2) and (3): Genetically modified maize MON 87427,2025-11-25T13:00:29,Food and agriculture,ADOPTED
181832,Objection pursuant to Rule 115(2) and (3): Genetically modified cotton MON 88913,2025-11-25T12:59:09,Food and agriculture,ADOPTED
181833,Objection pursuant to Rule 115(2) and (3): Genetically modified soybean MON 87708,2025-11-25T12:59:53,Food and agriculture,ADOPTED
181879,European Defence Industry Programme and a framework of measures to ensure the timely availability and supply of defence products (‘EDIP’),2025-11-25T12:28:54,Economy and budget,REJECTED
181995,"Enhancing police cooperation in relation to the prevention, detection and investigation of migrant smuggling and trafficking in human beings; enhancing Europol’s support to preventing and combating such crimes",2025-11-25T12:28:11,,ADOPTED
180621,Digital Trade Agreement between the European Union and the Republic of Singapore,2025-11-13T11:55:08,"Foreign affairs, International trade",ADOPTED
180622,Digital Trade Agreement between the European Union and the Republic of Singapore (Resolution),2025-11-13T11:55:30,"Foreign affairs, International trade",ADOPTED
180633,Mobilisation of the European Union Solidarity Fund: assistance to Spain and France in relation to natural disasters in 2024 and 2025,2025-11-13T12:04:07,"Climate and environment, Economy and budget",ADOPTED
180663,Business in Europe: Framework for Income Taxation (BEFIT),2025-11-13T11:59:28,,ADOPTED
180948,Certain corporate sustainability reporting and due diligence requirements,2025-11-13T11:50:11,Climate and environment,ADOPTED
180953,Addressing transnational repression of human rights defenders,2025-11-13T10:49:46,,ADOPTED
180954,Conservation and sustainable use of marine biological diversity of areas beyond national jurisdiction,2025-11-13T11:06:48,"Climate and environment, Biodiversity, Food and agriculture",ADOPTED
180979,Exceptional trade measures for countries and territories participating in or linked to the Stabilisation and Association Process,2025-11-13T11:52:35,"Foreign affairs, International trade",ADOPTED
180980,Opinion from the Court of Justice on the compatibility with the Treaties of the proposed Agreement on Digital Trade between the European Union and the Republic of Singapore,2025-11-13T11:53:00,"Foreign affairs, International trade",REJECTED
180983,Certain corporate sustainability reporting and due diligence requirements,2025-11-13T11:07:55,Climate and environment,REJECTED
181339,Gender Equality Strategy 2025,2025-11-13T12:25:44,Gender equality,ADOPTED
181343,Proxy voting in plenary for Members during pregnancy and after giving birth,2025-11-13T10:47:16,,ADOPTED
181375,Framework for achieving climate neutrality,2025-11-13T11:05:26,"Climate change, Climate and environment, Energy",ADOPTED
181393,Framework for achieving climate neutrality,2025-11-13T10:56:12,"Climate change, Climate and environment, Energy",REJECTED
180250,Objection pursuant to Rule 114(3): InvestEU Fund strategic investments in the field of defence,2025-10-23T12:04:28,Economy and budget,REJECTED
180290,Objections pursuant to Rule 114(3): Specifying a methodology for assessing greenhouse gas emissions savings from low-carbon fuels,2025-10-23T12:04:59,Energy,REJECTED
180291,Objections pursuant to Rule 114(3): Specifying a methodology for assessing greenhouse gas emissions savings from low-carbon fuels,2025-10-23T12:05:16,Energy,REJECTED
180520,Soil Monitoring and Resilience (Soil Monitoring Law),2025-10-23T12:08:06,"Climate and environment, Biodiversity",REJECTED
180598,Renewing the EU-Africa partnership: building common priorities ahead of the Angola Summit,2025-10-23T12:18:23,Foreign affairs,ADOPTED
179841,Discharge 2023: Agencies,2025-10-22T13:59:22,Economy and budget,ADOPTED
179918,"Situation in Belarus, five years after the fraudulent presidential elections",2025-10-22T14:08:48,,ADOPTED
179934,Discharge 2023: EU general budget – European Council and Council,2025-10-22T13:58:19,Economy and budget,ADOPTED
180153,General budget of the European Union for the financial year 2026 – all sections,2025-10-22T13:53:11,Economy and budget,ADOPTED
180195,Institutional consequences of the EU enlargement negotiations,2025-10-22T14:04:57,Enlargement,ADOPTED
180245,"Polarisation and increased repression in Serbia, one year after the Novi Sad tragedy",2025-10-22T14:07:22,Climate and environment,ADOPTED
179786,"Common data platform on chemicals, establishing a monitoring and outlook framework for chemicals",2025-10-21T12:20:06,"Climate and environment, Economy and budget",ADOPTED
179788,Re-attribution of scientific and technical tasks to the European Chemicals Agency,2025-10-21T12:20:34,"Climate and environment, Economy and budget",ADOPTED
179790,Re-attribution of scientific and technical tasks and improving cooperation among Union agencies in the area of chemicals,2025-10-21T12:20:59,"Climate and environment, Economy and budget",ADOPTED
179801,Standing Forest and Forestry Expert Group,2025-10-21T12:31:42,Food and agriculture,ADOPTED
179804,Monitoring framework for resilient European forests,2025-10-21T12:25:22,Food and agriculture,ADOPTED
179816,A new legislative framework for products that is fit for the digital and sustainable transition,2025-10-21T12:33:08,Consumer protection,ADOPTED
179820,General Data Protection Regulation: additional procedural rules relating to the enforcement of the Regulation,2025-10-21T12:21:25,Consumer protection,ADOPTED
179824,Statute and funding of European political parties and European political foundations,2025-10-21T12:22:11,Economy and budget,ADOPTED
179280,Establishment and functioning of European Works Councils - effective enforcement,2025-10-09T12:12:34,Worker’s rights,ADOPTED
179295,Deliberations of the Committee on Petitions in 2024,2025-10-09T12:15:35,,ADOPTED
179441,The role of simple tax rules and tax fragmentation in European competitiveness,2025-10-09T12:13:00,Taxation,ADOPTED
179569,Motion of censure on the Commission,2025-10-09T12:09:41,,REJECTED
179571,Motion of censure on the Commission,2025-10-09T12:10:12,,REJECTED
179617,Second World Summit for Social Development,2025-10-09T12:33:19,,ADOPTED
179720,Situation in Afghanistan: supporting women and communities affected by the recent earthquakes,2025-10-09T12:18:17,,ADOPTED
179770,United response to recent Russian violations of the EU Member States’ airspace and critical infrastructure,2025-10-09T12:28:52,,ADOPTED
179775,"Humanitarian and security situation in Haiti, in particular the rising power of criminal gangs and the recent massacre in Cabaret",2025-10-09T12:11:37,,ADOPTED
179776,10th anniversary of the detention of jailed Swedish publisher Gui Minhai in China,2025-10-09T12:11:58,,ADOPTED
179203,Guidelines for the employment policies of the Member States,2025-10-08T12:56:16,Worker’s rights,ADOPTED
179211,Mobilisation of the European Globalisation Adjustment Fund: application EGF/2025/001 BE/BelGaN - Belgium,2025-10-08T13:02:04,"Worker’s rights, Economy and budget",ADOPTED
179219,Mobilisation of the European Globalisation Adjustment Fund: application EGF/2025/002 DE/Goodyear 2 - Germany,2025-10-08T13:01:11,"Economy and budget, Worker’s rights",ADOPTED
179234,Draft amending budget No 2/2025: update of revenue (own resources) and adjustments to expenditure,2025-10-08T13:00:12,Economy and budget,ADOPTED
179275,Strengthening of the position of farmers in the food supply chain,2025-10-08T12:52:34,Food and agriculture,ADOPTED
179281,EC-Côte d’Ivoire Fisheries Partnership Agreement – Protocol on the implementation of the Agreement for 2025-2029,2025-10-08T12:53:42,Food and agriculture,ADOPTED
179423,EU political strategy on Latin America,2025-10-08T13:03:05,Foreign affairs,ADOPTED
179481,Withdrawal of the European Union from the International Rubber Study Group (IRSG),2025-10-08T12:54:46,International trade,ADOPTED
179508,Objection pursuant to Rule 115(2) and (3): Genetically modified maize DP51291,2025-10-08T13:03:39,"Climate and environment, Food and agriculture, Consumer protection, Biodiversity",ADOPTED
179558,"Amending certain CAP Regulations as regards the conditionality system, types of intervention in the form of direct payment, types of intervention in certain sectors and rural development and annual performance reports, data and interoperability governance, suspensions of payments annual performance clearance and controls and penalties",2025-10-08T12:44:11,Food and agriculture,ADOPTED
179213,Revision of the Visa Suspension Mechanism,2025-10-07T12:25:00,Migration,ADOPTED
179221,Inland waterway transport: River Information Systems (RIS),2025-10-07T12:26:56,,ADOPTED
179222,Role of EU policies in shaping the European Sport Model,2025-10-07T12:27:56,,ADOPTED
179226,Extension of the derogation for heavy-duty vehicles with zero emissions,2025-10-07T12:27:33,,ADOPTED
178291,A new vision for the European Universities alliances,2025-09-11T12:20:01,"Education, youth and culture",ADOPTED
178397,Implementation and streamlining of EU internal market rules to strengthen the single market,2025-09-11T12:21:26,,ADOPTED
178399,Stock-taking of the European elections 2024,2025-09-11T12:23:05,,ADOPTED
178484,Package travel and linked travel arrangements: make the protection of travellers more effective and simplify and clarify certain aspects,2025-09-11T12:17:19,"Travel, Consumer protection",ADOPTED
178875,Situation in Colombia after the wave of recent terrorist attacks,2025-09-11T12:43:05,,ADOPTED
178979,Case of Victoire Ingabire in Rwanda,2025-09-11T12:14:35,,ADOPTED
178988,Detention of EU citizens in the occupied areas of Cyprus,2025-09-11T12:13:27,,ADOPTED
179048,Gaza at breaking point: EU action to combat famine and the urgent need to release hostages and move towards a two-state solution,2025-09-11T12:39:55,Gender equality,ADOPTED
178281,Role of cohesion policy investment in resolving the current housing crisis,2025-09-10T13:25:58,,ADOPTED
178285,Carbon Border Adjustment Mechanism: simplification and strengthening,2025-09-10T13:19:49,"Climate change, Climate and environment",ADOPTED
178385,EC-India Agreement for scientific and technological cooperation: renewal of the Agreement,2025-09-10T13:21:50,,ADOPTED
178386,EU-Switzerland Cooperation Agreement: European Satellite Navigation Programmes,2025-09-10T13:22:10,Economy and budget,ADOPTED
178389,Role of cohesion policy in supporting the just transition,2025-09-10T13:24:07,,ADOPTED
178400,Possibilities for simplification of cohesion funds,2025-09-10T13:26:23,,ADOPTED
178401,Extension of the timeframe for the establishment of the Eurojust case management system,2025-09-10T13:21:01,,ADOPTED
178405,Securities settlement in the EU and central securities depositories (CSDs): shorter settlement cycle in the Union,2025-09-10T13:20:15,,ADOPTED
178406,Insolvency proceedings: replacing Annexes A and B,2025-09-10T13:20:38,,ADOPTED
178425,EC-Pacific States Interim Partnership Agreement: accession of Vanuatu,2025-09-10T13:21:28,"Foreign affairs, International trade, Food and agriculture",ADOPTED
178500,Future of agriculture and the post-2027 common agricultural policy,2025-09-10T13:29:45,Food and agriculture,ADOPTED
178702,European Social Fund (ESF+): specific measures to address strategic challenges,2025-09-10T13:17:38,,ADOPTED
178731,Investments and reforms for European competitiveness and the creation of a Capital Markets Union,2025-09-10T13:23:06,,ADOPTED
178767,"Amending ERDF, Cohesion Fund and Just Transition Fund as regards specific measures to address strategic challenges in the context of the mid-term review",2025-09-10T13:19:03,,ADOPTED
178788,Strengthening Moldova’s resilience against Russian hybrid threats and malign interference,2025-09-10T13:32:25,Foreign affairs,ADOPTED
178334,2023 and 2024 reports on Ukraine,2025-09-09T13:19:05,Enlargement,ADOPTED
178336,EU-Brazil Agreement: cooperation with and through Europol and the Federal Police of Brazil,2025-09-09T12:51:18,,ADOPTED
178384,Public procurement,2025-09-09T13:10:56,,ADOPTED
178387,EU-Kyrgyz Republic Enhanced Partnership and Cooperation Agreement,2025-09-09T12:52:53,"Foreign affairs, International trade",ADOPTED
178424,EU-Kyrgyz Republic Enhanced Partnership and Cooperation Agreement (Resolution),2025-09-09T12:55:32,"Foreign affairs, International trade",ADOPTED
178472,Circularity requirements for vehicle design and management of end-of-life vehicles,2025-09-09T12:48:59,"Climate and environment, Economy and budget",ADOPTED
177697,"Future of the EU biotechnology and biomanufacturing sector: leveraging research, boosting innovation and enhancing competitiveness",2025-07-10T12:15:56,,ADOPTED
178147,Amending Regulation (EU) 2023/1542 as regards obligations of economic operators concerning battery due diligence policies,2025-07-10T12:11:23,Climate and environment,ADOPTED
178149,Motion of censure on the Commission,2025-07-10T12:03:19,,REJECTED
